"auctionEndDate","auctionResultAuctionEnded","auctionResultBids","auctionResultHighBid","auctionResultReserveMet","auctionResultViews","auctionResultWatchers","auctionStatus","auctionUrl","countryCode","countryCodeAlpha3","currency","currentBid","currentBidFormatted","description","currentBidder","detailLocation","era","id","inSubscription","listingDetails/0","listingDetails/1","listingDetails/2","listingDetails/3","listingDetails/4","listingDetails/5","listingDetails/6","listingDetails/7","listingDetails/8","listingDetails/9","listingDetails/10","listingDetails/11","listingDetails/12","listingDetails/13","listingDetails/14","listingDetails/15","listingDetails/16","listingDetails/17","listingDetails/18","listingDetails/19","listingDetails/20","listingDetails/21","listingDetails/22","listingDetails/23","listingDetails/24","listingDetails/25","listingDetails/26","listingDetails/27","listingDetails/28","listingDetails/29","listingDetails/30","lotNumber","model","make","noReserve","privatePartyOrDealer","repeat","reserveMet","soldText","title","views"
"2026-01-17T19:25:18.000Z","January 17, 2026 at 11:25AM PT","29","54911","false","11632","1516","ended","https://bringatrailer.com/listing/1983-porsche-911sc-158/","US","USA","USD","54911","USD $54,911","This 1983 Porsche 911SC coupe was registered in Missouri from new until it was acquired by the seller &lt;a href=&quot;https://bringatrailer.com/listing/1983-porsche-911sc-128/&quot; target=&quot;_blank&quot; rel=&quot;noopener&quot;&gt;on BaT in August 2024&lt;/a&gt;. Finished in black over black leather, the car is powered by a 3.0-liter flat-six paired with a five-speed manual transaxle.","shannonharper","Located in United States","1980s","107607826","false","Chassis: WP0AA0911DS122485","132k Miles Shown","3.0-Liter Flat-Six","Five-Speed Manual Transaxle","Black Paint","Black Leather Upholstery","16"" Fuchs Alloy Wheels","Front Chin Spoiler","Rear Spoiler","Power Sunroof","Front Sport Seats","MOMO Steering Wheel","Power Windows","Continental Stereo w/Bluetooth","Accident-Free Carfax Report",,,,,,,,,,,,,,,,,"226826","Porsche 911SC","Porsche","false","Private Party","true","false","Sold for USD $54,911 <span> on 1/17/26 </span>","1983 Porsche 911SC Coupe","0 Views"
"2026-01-17T19:04:36.000Z","January 17, 2026 at 11:04AM PT","48","58000","false","16804","1861","ended","https://bringatrailer.com/listing/1977-porsche-911s-coupe-44/","US","USA","USD","58000","USD $58,000","This 1977 Porsche 911s Coupe remained in the care of its original owner until it was acquired on BaT in March 2024 by the seller, who subsequently installed a wood-trimmed shift knob and MOMO steering wheel. Refinished in beige over Cork leather, the car is powered by an overhauled 2.7-liter flat-six paired with a rebuilt five-speed manual…","Lauren_S","Located in United States","1970s","107030300","false","Chassis: 9117200891","250k Miles Shown","Overhauled 2.7-Liter Flat-Six","Rebuilt 5-Speed Manual Transaxle","Mahle Pistons & Cylinders","Repainted Beige","Cork Leather Upholstery","Sunroof","H4 Headlight Conversion","Fog Lights","15"" Fuchs Wheels","Bilstein Shocks","Polished Heat Exchangers","Dansk Muffler","Air Conditioning","Pioneer Head Unit","MOMO Steering Wheel","Wood Shift Knob",,,,,,,,,,,,,,"226785","Porsche 911 1974-1977","Porsche","false","Private Party","true","false","Sold for USD $58,000 <span> on 1/17/26 </span>","1977 Porsche 911S Coupe 5-Speed","0 Views"
"2026-01-17T18:31:14.000Z","January 17, 2026 at 10:31AM PT","32","36000","false","8008","900","ended","https://bringatrailer.com/listing/2006-porsche-911-carrera-s-cabriolet-66-2/","US","USA","USD","36000","USD $36,000","This 2006 Porsche 911 Carrera S is a silver-over-black cabriolet that was exported to Canada in 2013 and was relocated back to the US in 2024. Powered by a 3.8-liter flat-six paired with a six-speed manual transaxle, the car is equipped with a black soft top, 19″ Carrera S wheels, the Sport Chrono Package, automatic climate control, heated…","MJFNYC","Located in United States","2000s","106536776","false","Chassis: WP0CB29986S765538","74k Miles","3.8-Liter Flat Six","Six-Speed Manual Transaxle","Arctic Silver Metallic Paint","Black Soft Top","Black Leather Upholstery","19″ Carrera S Wheels","Sport Chrono Package","Heated Power-Adjustable Front Seats","Bose Sound System","Window Sticker",,,,,,,,,,,,,,,,,,,,"226751","Porsche 997 911 Carrera S","Porsche","false","Dealer","false","false","Sold for USD $36,000 <span> on 1/17/26 </span>","2006 Porsche 911 Carrera S Cabriolet 6-Speed","0 Views"
"2026-01-17T18:29:22.000Z","January 17, 2026 at 10:29AM PT","30","56996","false","9159","1027","ended","https://bringatrailer.com/listing/2004-porsche-911-carrera-4s-cabriolet-71/","US","USA","USD","56996","USD $56,996","This 2004 Porsche 911 Carrera 4S cabriolet has 13k miles following history with three registered owners, and it was specified in Carmon Red Metallic over a Graphite Grey full supple leather interior. The car is powered by a 3.6-liter flat-six that drives all four wheels through a six-speed manual transaxle, and was optioned with the Bose High End…","3933514r","Located in United States","2000s","106657793","false","Chassis: WP0CA29994S653685","13k Miles","3.6-Liter Flat-Six","Six-Speed Manual Transaxle","Carmon Red Metallic Paint","Graphite Grey Full Supple Leather","18″ Turbo-Look Wheels","Bose High End Sound Package","Small Dark Wood Package","Body-Color Removable Hardtop","Graphite Grey Convertible Soft Top","Xenon Headlights","Heated Front Seats","Optional Thicker Steering Wheel","Sport Shifter","Window Sticker","Clean Carfax Report",,,,,,,,,,,,,,,"226755","Porsche 996 911 Carrera","Porsche","true","Dealer","false","true","Sold for USD $56,996 <span> on 1/17/26 </span>","13k-Mile 2004 Porsche 911 Carrera 4S Cabriolet 6-Speed","0 Views"
"2026-01-16T20:55:26.000Z","January 16, 2026 at 12:55PM PT","46","109106","false","16882","1602","ended","https://bringatrailer.com/listing/1973-porsche-911t-targa-73/","US","USA","USD","109106","USD $109,106","This 1973 Porsche 911T Targa was acquired by the current owner in 2022 and was refurbished and modified between 2023 and 2024. It has been repainted black and features steel fender flares, a 911S-style front bumper, and an RS-style rear bumper, while the interior was refreshed with black vinyl and fabric fixed-back seats, replacement carpets, and…","706miles2Chi","Located in United States","1970s","107395430","false","Chassis: 9113110547","300 Miles Shown, TMU","2.4-Liter Flat-Six","Dual Weber Carburetors","915 Five-Speed Manual Transaxle","Repainted Black","Black Vinyl And Cloth Upholstery","16"" Fuchs Wheels","Steel Fender Flares","911S-Style Front Bumper","RS-Style Rear Bumper","MOMO Steering Wheel","Leather Window Pull Straps","Fixed-Back Bucket Seats",,,,,,,,,,,,,,,,,,"226722","Porsche LWB 911T (1969-1973)","Porsche","false","Dealer","false","false","Sold for USD $109,106 <span> on 1/16/26 </span>","RSR-Style 1973 Porsche 911T Targa 5-Speed","0 Views"
"2026-01-16T20:39:25.000Z","January 16, 2026 at 12:39PM PT","33","96500","false","32624","2325","ended","https://bringatrailer.com/listing/1979-porsche-930-turbo-139/","US","USA","USD","96500","USD $96,500","This 1979 Porsche 930 Turbo is finished in Black Metallic over black leather upholstery and powered by a turbocharged 3.3-liter flat-six paired with a four-speed manual transaxle. Equipment includes front and rear spoilers, fog lights, 16″ Fuchs wheels, and an aftermarket stereo system. It was previously sold on BaT in March 2023 and was…","MaikoR","Located in United States","1970s","106301803","false","Chassis: 9309800441","98k Miles Shown","Turbocharged 3.3-Liter Flat-Six","Four-Speed Manual Transaxle","Black Metallic Paint","Black Leather Upholstery","16"" Fuchs Alloy Wheels","Tea Tray Rear Spoiler","Fog Lights","Aftermarket Stereo System","Owner's Manual",,,,,,,,,,,,,,,,,,,,,"226729","Porsche 930 Turbo","Porsche","false","Dealer","true","false","Sold for USD $96,500 <span> on 1/16/26 </span>","1979 Porsche 930 Turbo","0 Views"
"2026-01-16T20:34:59.000Z","January 16, 2026 at 12:34PM PT","37","86500","false","5647","837","ended","https://bringatrailer.com/listing/2018-porsche-911-carrera-4-cabriolet-3/","US","USA","USD","86500","USD $86,500","This 2018 Porsche 911 Carrera 4 is a Guards Red-finished cabriolet that has 11k miles through the owner&#039;s purchase in 2022, and it was optioned with the Premium Package Plus. Powered by a twin-turbocharged 3.0L flat-six that drives all four wheels through a seven-speed PDK dual-clutch transaxle, the car is further equipped with black leather…","blakem357","Located in United States","2010s","106710687","false","Chassis: WP0CA2A92JS138521","11k Miles","Twin-Turbocharged 3.0L Flat-Six","Seven-Speed PDK Dual-Clutch Transaxle","Guards Red Paint","Black Leather Upholstery","Black Soft Top","High Gloss Black 20"" Carrera S Alloy Wheels","Premium Package Plus","LED Headlights w/PDLS+","Parking Sensors","Lane Change Assist","Heated and Ventilated Front Seats","Bose Sound System","Sport Exhaust System","Clean Carfax Report",,,,,,,,,,,,,,,,"226707","Porsche 991 911 Carrera 4","Porsche","false","Private Party","false","false","Sold for USD $86,500 <span> on 1/16/26 </span>","11k-Mile 2018 Porsche 911 Carrera 4 Cabriolet","0 Views"
"2026-01-16T20:28:42.000Z","January 16, 2026 at 12:28PM PT","25","242000","false","10724","1230","ended","https://bringatrailer.com/listing/2023-porsche-911-gt3-34/","US","USA","USD","242000","USD $242,000","This 2023 Porsche 911 GT3 has 2,200 miles and is powered by a 4.0-liter flat-six that drives the rear wheels through a six-speed manual transaxle with a mechanical limited-slip differential. Finished in Shark Blue over black leather and Race-Tex upholstery, the car is equipped with the Chrono package, a front-axle lift system, LED headlights, a…",,"Located in United States","2020s","107401151","false","Chassis: WP0AC2A91PS270325","2,200 Miles","4.0-Liter Flat-Six","Six-Speed Manual Transaxle","Shark Blue Paint","Black Leather & Race-Tex Upholstery","20"" & 21"" GT3 Center-Lock Wheels","LED Headlights & Exclusive Design Taillights","Front-Axle Lift System","Bose Sound System","Porsche Communication Management","Fire Extinguisher","Heated Sport Seats","Chrono Package","Clean Carfax Report",,,,,,,,,,,,,,,,,"226714","Porsche 992 911 GT3","Porsche","false","Dealer","false","false","Bid to USD $242,000 <span> on 1/16/26 </span>","2023 Porsche 911 GT3 6-Speed","0 Views"
"2026-01-16T20:25:20.000Z","January 16, 2026 at 12:25PM PT","38","62500","false","7739","997","ended","https://bringatrailer.com/listing/2008-porsche-911-turbo-cabriolet-169/","US","USA","USD","62500","USD $62,500","This 2008 Porsche 911 Turbo cabriolet is finished in GT Silver Metallic over a Cocoa Special leather interior and has 62k miles. It is powered by a twin-turbocharged 3.6L flat-six that drives all four wheels via a five-speed Tiptronic S automatic transaxle, and additional equipment includes a Cocoa soft top, the Sport Chrono Package, 19” Turbo…","Sdiamond","Located in United States","2000s","107307606","false","Chassis: WP0CD29938S708399","62k Miles","Twin-Turbocharged 3.6L Flat-Six","Five-Speed Tiptronic S Automatic Transaxle","GT Silver Metallic Paint","Cocoa Special Leather Upholstery","Cocoa Soft Top","19” Turbo Wheels","Sport Chrono Package","Bi-Xenon Headlights","PCM w/Navigation","Heated Front Sport Seats","Automatic Climate Control","Clean Carfax Report",,,,,,,,,,,,,,,,,,"226703","Porsche 997 911 Turbo","Porsche","false","Dealer","false","false","Sold for USD $62,500 <span> on 1/16/26 </span>","2008 Porsche 911 Turbo Cabriolet","0 Views"
"2026-01-16T20:23:00.000Z","January 16, 2026 at 12:23PM PT","11","45000","false","7756","1134","ended","https://bringatrailer.com/listing/1978-porsche-911sc-targa-84/","US","USA","USD","45000","USD $45,000","This 1978 Porsche 911SC Targa was purchased by the seller while stationed in Germany in 1991, and it is finished in Sienna Metallic over Cork leather upholstery. Powered by a 3.0-liter flat-six paired with a five-speed manual transaxle, the car features  15&quot; ATS &quot;cookie-cutter&quot; alloy wheels, a removable roof panel, a leather-wrapped steering…","jaime210","Located in United States","1970s","107384577","false","Chassis: 9118212116","121k Miles Shown","3.0-Liter Flat-Six","Five-Speed Manual Transaxle","Sienna Metallic Paint","Cork Leather Upholstery","15"" ATS Cookie-Cutter Wheels","Removable Targa Roof Panel","Air Conditioning","Aftermarket Stereo","Spare Set of Wheels",,,,,,,,,,,,,,,,,,,,,"226710","Porsche 911SC","Porsche","false","Private Party","false","false","Sold for USD $45,000 <span> on 1/16/26 </span>","35-Years-Owned 1978 Porsche 911SC Targa","0 Views"
"2026-01-16T20:11:34.000Z","January 16, 2026 at 12:11PM PT","46","219000","false","8927","1208","ended","https://bringatrailer.com/listing/2021-porsche-911-targa-4s-42/","US","USA","USD","219000","USD $219,000","This 2021 Porsche 911 Targa 4S is one of 992 Heritage Design Edition examples produced for the model year, and it now has 810 miles. It is finished in Chalk with Heritage Design graphics and gold badging, and the Heritage Design Interior is trimmed in Bordeaux Red and Atacama Beige Olea Club leather with corduroy accents.",,"Located in United States","2020s","107641314","false","Chassis: WP0BB2A91MS235397","810 Miles","Twin-Turbocharged 3.0L Flat-Six","Eight-Speed PDK Dual-Clutch Automatic Transaxle","Chalk Paint","Bordeaux Red and Atacama Beige Olea Club Leather Upholstery","20"" and 21"" Carrera Exclusive Manufaktur Alloy Wheels","Front-Axle Lift System","Retractable Targa Top","SportDesign Side Skirts","Heated & Power-Adjustable Front Seats","PCM w/Navigation","Bose Sound System","Surround-View Camera System","Window Sticker","Total Vehicle Price of $202k in 2021",,,,,,,,,,,,,,,,"226662","Porsche 992 911 Targa 4S Heritage Design Edition","Porsche","false","Dealer","false","false","Bid to USD $219,000 <span> on 1/16/26 </span>","2021 Porsche 911 Targa 4S Heritage Design Edition","0 Views"
"2026-01-16T19:44:00.000Z","January 16, 2026 at 11:44AM PT","23","74900","false","9125","1137","ended","https://bringatrailer.com/listing/1991-porsche-911-carrera-2-targa-23/","US","USA","USD","74900","USD $74,900","This 1991 Porsche 911 Carrera 2 Targa was registered with its previous owner from 2005 until it was listed on BaT in August 2023, and it was acquired by the current owner later that year. Finished in Guards Red over black partial leather, the car is powered by a 3.6-liter flat-six paired with a four-speed Tiptronic automatic transaxle.",,"Located in United States","1990s","106928090","false","Chassis: WP0BB2964MS440299","49k Miles Shown","3.6-Liter M64 Flat-Six","Four-Speed Automatic Transaxle","Guards Red Paint","Black Partial Leather Upholstery","Removable Targa Roof Panel","17"" Cup Wheels","Power-Adjustable Front Seats","Speed-Activated Rear Spoiler","Porsche CD Stereo","Air Conditioning","Cruise Control","Window Sticker","Porsche Certificate of Authenticity",,,,,,,,,,,,,,,,,"226648","Porsche 964 911 (Non-Turbo)","Porsche","false","Dealer","true","false","Bid to USD $74,900 <span> on 1/16/26 </span>","1991 Porsche 911 Carrera 2 Targa","0 Views"
"2026-01-16T19:28:00.000Z","January 16, 2026 at 11:28AM PT","15","15000","false","6492","701","ended","https://bringatrailer.com/listing/1999-porsche-911-carrera-cabriolet-146/","US","USA","USD","15000","USD $15,000","This 1999 Porsche 911 Carrera cabriolet was acquired by the seller in 2022 and has since been driven approximately 8k of its 62k miles. The car is powered by a 3.4-liter M96 flat-six paired with a six-speed manual transaxle and is finished in Black over black leather. Equipment includes a black soft top, a deployable rear spoiler, 18” Carrera II…",,"Located in United States","1990s","107440288","false","Chassis: WP0CA299XXS650217","62k Miles","3.4-Liter M96 Flat-Six","Six-Speed Manual Transaxle","Black Paint","Black Leather Upholstery","18” Carrera II Wheels","Deployable Rear Spoiler","Cruise Control","Automatic Climate Control","Blaupunkt Radio","Clean Carfax Report",,,,,,,,,,,,,,,,,,,,"226678","Porsche 996 911 Carrera","Porsche","false","Private Party","false","false","Bid to USD $15,000 <span> on 1/16/26 </span>","1999 Porsche 911 Carrera Cabriolet 6-Speed","0 Views"
"2026-01-16T18:09:37.000Z","January 16, 2026 at 10:09AM PT","21","210000","false","13936","1305","ended","https://bringatrailer.com/listing/1994-porsche-911-speedster-20-2/","US","USA","USD","210000","USD $210,000","This 1994 Porsche 911 Speedster is one of 936 examples produced between 1992 and 1994, just 427 of which were built for the US market. It is powered by a 3.6-liter flat-six paired with a G50 five-speed manual transaxle and is finished in Black over matching leather upholstery. Equipment includes 17″ Cup alloy wheels, a black soft top, a…","CoolClassicsIntl","Located in United States","1990s","107211878","false","Chassis: WP0CB2964RS465344","9k Miles Shown","3.6-Liter Flat-Six","G50 Five-Speed Manual Transaxle","Black Paint","Black Soft Top","Black Leather Upholstery","17"" Cup Alloy Wheels","Speed-Activated Rear Spoiler","Power-Height-Adjustable Seats","Air Conditioning","CDR-210 Stereo","Yellow Interior Accents","Clean Carfax Report",,,,,,,,,,,,,,,,,,"226231","Porsche 964 911 Speedster","Porsche","false","Dealer","true","false","Sold for USD $210,000 <span> on 1/16/26 </span>","9k-Mile 1994 Porsche 911 Speedster 5-Speed","0 Views"
"2026-01-15T20:59:55.000Z","January 15, 2026 at 12:59PM PT","33","27500","false","10946","1112","ended","https://bringatrailer.com/listing/1999-porsche-911-carrera-coupe-191/","US","USA","USD","27500","USD $27,500","This 1999 Porsche 911 Carrera coupe is finished in black over Savanna Beige leather and is powered by a 3.4-liter M96 flat-six paired with a six-speed manual transaxle. Features include a sunroof, the Power Seat Package, a deployable rear spoiler, 18″ Turbo-look wheels, cruise control, a CD stereo, and automatic climate control.","francescolomonaco","Located in United States","1990s","107293890","false","Chassis: WP0AA2994XS622050","99k Miles","3.4-Liter Flat-Six","Six-Speed Manual Transaxle","Black Paintwork","Savanna Beige Leather","18″ 993-Style Turbo-Look Wheels","Sunroof","Power Seat Package","Deployable Rear Spoiler","CD Stereo","Cruise Control","Automatic Climate Control",,,,,,,,,,,,,,,,,,,"226598","Porsche 996 911 Carrera","Porsche","false","Dealer","false","false","Sold for USD $27,500 <span> on 1/15/26 </span>","1999 Porsche 911 Carrera Coupe 6-Speed","0 Views"
"2026-01-15T20:46:34.000Z","January 15, 2026 at 12:46PM PT","34","61000","false","14121","1515","ended","https://bringatrailer.com/listing/2002-porsche-911-turbo-coupe-90/","US","USA","USD","61000","USD $61,000","This 2002 Porsche 911 Turbo coupe was modified under previous ownership with a TechArt body kit, rear wing, 18″ wheels, exhaust tips, and pedal covers, and it is powered by a twin-turbocharged 3.6L flat-six that drives all four wheels via a five-speed Tiptronic automatic transaxle. Finished in Arctic Silver Metallic over black full leather…","IrishWhiskey","Located in United States","2000s","107549191","false","Chassis: WP0AB29912S687041","64k Miles","Twin-Turbocharged 3.6-Liter Flat Six","Five-Speed Automatic Transaxle","Arctic Silver Metallic Paint","Black Full Leather Upholstery","TechArt Body Kit & Rear Spoiler","18"" TechArt Wheels","Bi-Xenon Headlights","Sunroof","Heated & Powered Front Sport Seats","Wood Interior Trim","Bose Speakers","Cruise Control","Clean Carfax Report",,,,,,,,,,,,,,,,,"226593","Porsche 996 911 Turbo","Porsche","true","Dealer","true","true","Sold for USD $61,000 <span> on 1/15/26 </span>","2002 Porsche 911 Turbo Coupe","0 Views"
"2026-01-15T20:41:33.000Z","January 15, 2026 at 12:41PM PT","28","57991","false","6790","757","ended","https://bringatrailer.com/listing/2019-porsche-911-carrera-cabriolet-8/","US","USA","USD","57991","USD $57,991","This 2019 Porsche 911 Carrera Cabriolet was specified with Carrara White Metallic paintwork, ventilated power sport seats with Espresso and Cognac natural leather upholstery, 20&quot; RS Spyder Design wheels, the Premium Package, a Bose sound system, and Porsche Entry &amp; Drive. Its twin-turbocharged 3.0L flat-six is paired with an…",,"Located in United States","2010s","106172699","false","Chassis: WP0CA2A91KS129343","77k Miles","Twin-Turbocharged 3.0L Flat-Six","Seven-Speed PDK Dual-Clutch Transaxle","Carrara White Metallic","Black Convertible Soft Top","Cognac & Espresso Natural Leather Upholstery","20"" RS Spyder Design Alloy Wheels","Premium Package","Bi-Xenon Headlights w/PDLS","Heated & Ventilated Front Sport Seats","Bose Surround-Sound System","Back-Up Camera","Dual-Zone Automatic Climate Control","Window Sticker","Clean Carfax Report",,,,,,,,,,,,,,,,"226586","Porsche 991 911 Carrera","Porsche","false","Private Party","false","false","Bid to USD $57,991 <span> on 1/15/26 </span>","2019 Porsche 911 Carrera Cabriolet","0 Views"
"2026-01-15T20:14:13.000Z","January 15, 2026 at 12:14PM PT","32","74000","false","7915","1017","ended","https://bringatrailer.com/listing/2012-porsche-911-carrera-4-gts-42/","US","USA","USD","74000","USD $74,000","This 2012 Porsche 911 Carrera 4 GTS cabriolet has 21k miles following history with two registered owners, and it was ordered with over $11k in optional equipment including the Sport Chrono Package Plus, PCM 3.0 with Extended Navigation, heated front sport seats, a Bose surround sound system, bi-xenon headlights with PDLS, clear taillights, and…","ChevronJohn","Located in United States","2010s","107113023","false","Chassis: WP0CB2A96CS754836","21k Miles","3.8-Liter Flat-Six","Seven-Speed PDK Dual-Clutch Transaxle","Carrara White Paint","Black Leather & Alcantara Interior","19″ RS Spyder Center-Lock Wheels","Sport Chrono Package Plus","Black Soft Top","Bi-Xenon Headlights w/PDLS","Clear Taillights","PCM 3.0 w/Extended Navigation","Bose Surround Sound System","Heated Front Sport Seats","Clean Carfax Report",,,,,,,,,,,,,,,,,"226557","Porsche 997 911 Carrera 4 GTS","Porsche","false","Dealer","false","false","Sold for USD $74,000 <span> on 1/15/26 </span>","21k-Mile 2012 Porsche 911 Carrera 4 GTS Cabriolet","0 Views"
"2026-01-15T18:40:14.000Z","January 15, 2026 at 10:40AM PT","45","122000","false","29593","2029","ended","https://bringatrailer.com/listing/2007-porsche-911-turbo-coupe-194/","US","USA","USD","122000","USD $122,000","This 2007 Porsche 911 Turbo coupe is finished in Black over Black leather, and it is powered by a twin-turbocharged 3.6L flat-six that drives all four wheels via a six-speed manual transaxle. The car was optioned with the Sport Chrono Package, and additional features include 20&quot; CEC wheels, bi-xenon headlights, a power sunroof, PCM with…","Mhpilot9","Located in United States","2000s","106819333","false","Chassis: WP0AD29977S784729","46k Miles","Twin-Turbocharged 3.6-Liter Flat-Six","Six-Speed Manual Transaxle","Black Paint","Black Leather Upholstery","20"" CEC Wheels","Europipe Exhaust System","Power Sunroof","Rear Spoiler","Heated Power-Adjustable Front Seats","PCM w/Navigation","CD Stereo","Bose Sound System",,,,,,,,,,,,,,,,,,"226498","Porsche 997 911 Turbo","Porsche","false","Private Party","false","false","Sold for USD $122,000 <span> on 1/15/26 </span>","2007 Porsche 911 Turbo Coupe 6-Speed","0 Views"
"2026-01-15T18:27:49.000Z","January 15, 2026 at 10:27AM PT","34","57500","false","13680","1525","ended","https://bringatrailer.com/listing/2004-porsche-911-carrera-4s-coupe-46/","US","USA","USD","57500","USD $57,500","This 2004 Porsche 911 Carrera 4S coupe is believed to have spent its first few years on a showroom floor before it was registered in Massachusetts and later Texas. It is finished in Slate Grey Metallic over black full supple leather and features 18″ Sport Techno wheels, stainless steel exhaust finishers, heated front seats, a Bose sound system,…",,"Located in United States","2000s","107037783","false","Chassis: WP0AA29994S622105","19k Miles","3.6-Liter Flat-Six","Six-Speed Manual Transaxle","All-Wheel Drive","Slate Gray Metallic Paint","Black Full Supple Leather Upholstery","18"" Sport Techno Wheels","Stainless Steel Exhaust Finishers","Heated Front Seats","Bose Sound System","Nokia Digital Sound Processing (DSP)","Aluminum Shifter & Handbrake Trim","Clean Carfax Report",,,,,,,,,,,,,,,,,,"226492","Porsche 996 911 Carrera 4S","Porsche","false","Dealer","false","false","Bid to USD $57,500 <span> on 1/15/26 </span>","19k-Mile 2004 Porsche 911 Carrera 4S Coupe 6-Speed","0 Views"
"2026-01-14T20:35:44.000Z","January 14, 2026 at 12:35PM PT","33","61500","false","8258","1083","ended","https://bringatrailer.com/listing/1980-porsche-911sc-135/","US","USA","USD","61500","USD $61,500","This 1980 Porsche 911SC Targa was initially delivered through Martin Johnson Porsche in Oakland, California, and remained under single-family ownership in the state until 2024. Finished in Copper Brown Metallic over tan leather, the car is powered by a 3.0-liter flat-six paired with a five-speed manual transaxle.",,"Located in United States","1980s","106475758","false","Chassis: 91A0142570","41k Miles Shown","3.0-Liter Flat-Six","Five-Speed Manual Transaxle","Copper Brown Metallic Paint","Tan Leather Upholstery","Disc Brakes","16"" BBS Alloy Wheels","Removable Roof Panel","Air Conditioning","Digital Rearview Mirror","Pursuit GPS Tracking System","Blaupunkt Cassette Stereo","Custom Sound System","Owner's Manual & Service Records","Spare Set of Wheels",,,,,,,,,,,,,,,,"226408","Porsche 911SC","Porsche","false","Private Party","true","false","Bid to USD $61,500 <span> on 1/14/26 </span>","1980 Porsche 911SC Targa","0 Views"
"2026-01-14T20:35:13.000Z","January 14, 2026 at 12:35PM PT","16","266000","false","13936","1271","ended","https://bringatrailer.com/listing/1997-porsche-911-turbo-102/","US","USA","USD","266000","USD $266,000","This 1997 Porsche 911 Turbo remained registered in Oregon until 2022 and now shows 35k miles. Powered by a twin-turbocharged 3.6L flat-six that drives all four wheels through a six-speed manual transaxle with a limited-slip differential, the car is finished in Arctic Silver Metallic over black leather upholstery.",,"Located in United States","1990s","106724632","false","Chassis: WP0AC2999VS375194","35k Miles Shown","Twin-Turbocharged 3.6-Liter Flat-Six","Six-Speed Manual Transaxle","Limited-Slip Differential","Arctic Silver Metallic Paint","Black Leather Upholstery","18″ Turbo Twist Wheels","Xenon Headlights","Fog Lights","Fixed Rear Spoiler","Power-Adjustable Front Seats","Cassette Stereo","Cruise Control","Air Conditioning","Clean Carfax Report",,,,,,,,,,,,,,,,"226480","Porsche 993 Turbo","Porsche","false","Dealer","false","false","Bid to USD $266,000 <span> on 1/14/26 </span>","35k-Mile 1997 Porsche 911 Turbo","0 Views"
"2026-01-14T20:15:23.000Z","January 14, 2026 at 12:15PM PT","51","97000","false","16239","1518","ended","https://bringatrailer.com/listing/1995-porsche-911-carrera-coupe-133/","US","USA","USD","97000","USD $97,000","This 1995 Porsche 911 Carrera coupe has been registered in California from new, and is said to have remained under the care of one family from 2000 until the current owner&#039;s purchase in 2025. It is powered by a 3.6-liter flat-six paired with a six-speed manual transaxle and is finished in Midnight Blue Metallic over blue leather upholstery.","BullitFZJ80","Located in United States","1990s","107094421","false","Chassis: WP0AA299XSS322974","117k Miles Shown","3.6‑Liter Flat‑Six","Six‑Speed Manual Transaxle","Midnight Blue Metallic Paint","Blue Leather Upholstery","17″ Cup II Wheels","Power‑Operated Sunroof","Power‑Adjustable Front Seats","Alpine Stereo","Cruise Control","Air Conditioning","Carfax Report",,,,,,,,,,,,,,,,,,,"226400","Porsche 993 911 (Non-Turbo/GT2)","Porsche","false","Private Party","false","false","Sold for USD $97,000 <span> on 1/14/26 </span>","1995 Porsche 911 Carrera Coupe 6-Speed","0 Views"
"2026-01-14T20:12:32.000Z","January 14, 2026 at 12:12PM PT","31","89000","false","8871","1174","ended","https://bringatrailer.com/listing/2012-porsche-911-carrera-4s-cabriolet-10/","US","USA","USD","89000","USD $89,000","This 2012 Porsche 911 Carrera 4S cabriolet remained with the second owner from 2014 until the selling dealer&#039;s acquisition in 2025, and the car now has 13k miles. It is powered by a 3.8-liter flat-six that drives all four wheels through a six-speed manual transaxle and is finished in black over black leather.","GlenSurf","Located in United States","2010s","106990084","false","Chassis: WP0CB2A95CS754763","13k Miles","3.8-Liter Flat-Six","Six-Speed Manual Transaxle","All-Wheel-Drive System","Black Paint","Black Leather Upholstery","19” Turbo II Wheels","Sport Chrono Package Plus","Infotainment Package","PCM w/Navigation","Bose Sound System","Heated & Ventilated Front Seats","Clean Carfax Report",,,,,,,,,,,,,,,,,,"226476","Porsche 997 911 Carrera 4S","Porsche","false","Dealer","false","false","Sold for USD $89,000 <span> on 1/14/26 </span>","13k-Mile 2012 Porsche 911 Carrera 4S Cabriolet 6-Speed","0 Views"
"2026-01-14T20:11:56.000Z","January 14, 2026 at 12:11PM PT","43","247991","false","14333","1529","ended","https://bringatrailer.com/listing/2019-porsche-911-gt3-rs-96/","US","USA","USD","247991","USD $247,991","This 2019 Porsche 911 GT3 RS has 4,600 miles through the owner&#039;s purchase in 2020, and it has been fitted with a GMG exhaust system. It is powered by a 4.0-liter flat-six paired with a seven-speed PDK dual-clutch transaxle and is finished in white over black leather and Alcantara. The car is further equipped with the Sport Chrono Package, 20&quot; and…","OZLO","Located in United States","2010s","107296459","false","Chassis: WP0AF2A97KS165367","4,600 Miles","4.0-Liter Flat-Six","Seven-Speed PDK Dual-Clutch Transaxle","White Paint","Black Leather and Alcantara Upholstery","20"" and 21"" Center-Lock Alloy Wheels","Carbon-Fiber Exterior and Interior Accents","Porsche Ceramic Composite Brakes","Front-Axle Lift","Carbon-Fiber Full Bucket Seats","Bose Sound System","GMG Exhaust","Removed Factory Exhaust","Window Sticker",,,,,,,,,,,,,,,,,"226438","Porsche 991 911 GT3","Porsche","false","Private Party","false","false","Sold for USD $247,991 <span> on 1/14/26 </span>","4,600-Mile 2019 Porsche 911 GT3 RS","0 Views"
"2026-01-14T19:55:23.000Z","January 14, 2026 at 11:55AM PT","17","50000","false","7931","964","ended","https://bringatrailer.com/listing/2004-porsche-911-carrera-4s-coupe-45/","US","USA","USD","50000","USD $50,000","This 2004 Porsche 911 Carrera 4S coupe has spent most of its time registered in Colorado, California, and Oregon, and 9k of the 67k miles have been added since the seller purchased the car in May 2024. It is finished in Guards Red over black leather with body-color backs and is powered by a 3.6-liter flat-six that drives all four wheels through a…","Pherman","Located in United States","2000s","106785138","false","Chassis: WP0AA299X4S621111","67k Miles","3.6-Liter Flat-Six","Six-Speed Manual Transaxle","Guards Red Paint","Black Leather Upholstery","18″ Turbo-Look Wheels","Xenon Headlights","Sunroof","Speed-Activated Rear Spoiler","Power-Adjustable Front Sport Seats","Automatic Climate Control","Kenwood Amplifier","Sony Touchscreen Head Unit w/Bluetooth Connectivity","Clean Carfax Report",,,,,,,,,,,,,,,,,"226464","Porsche 996 911 Carrera 4S","Porsche","false","Private Party","false","false","Sold for USD $50,000 <span> on 1/14/26 </span>","2004 Porsche 911 Carrera 4S Coupe 6-Speed","0 Views"
"2026-01-14T19:10:01.000Z","January 14, 2026 at 11:10AM PT","23","45750","false","4782","668","ended","https://bringatrailer.com/listing/2004-porsche-911-carrera-cabriolet-28/","US","USA","USD","45750","USD $45,750","This 2004 Porsche 911 Carrera cabriolet has 7k miles following history with two registered owners, and it was ordered with over $9k in optional equipment including the Bose High End Sound and Power Seat packages as well as Porsche Communication Management II, Basalt Black Metallic paint, 18&quot; Turbo-look wheels with full-color Porsche-crest center…","OSUBCZ","Located in United States","2000s","106932354","false","Chassis: WP0CA29914S653339","7k Miles","3.6-Liter M96 Flat-Six","Six-Speed Manual Transaxle","Basalt Black Metallic Paint","Black Standard Leather Upholstery","18″ Turbo-Look Wheels","Porsche Stability Management","Bose High End Sound Package","Power Seat Package","Black Soft Top","Porsche Communication Management II","Porsche Certificate of Authenticity","Window Sticker","Clean Carfax Report",,,,,,,,,,,,,,,,,"226419","Porsche 996 911 Carrera","Porsche","false","Dealer","false","false","Sold for USD $45,750 <span> on 1/14/26 </span>","7k-Mile 2004 Porsche 911 Carrera Cabriolet 6-Speed","0 Views"
"2026-01-14T18:48:00.000Z","January 14, 2026 at 10:48AM PT","12","37250","false","5770","835","ended","https://bringatrailer.com/listing/2005-porsche-911-carrera-s-cabriolet-22/","US","USA","USD","37250","USD $37,250","This 2005 Porsche 911 Carrera S cabriolet is finished in GT Silver Metallic over black leather, and it was specified with the Sport Chrono Package Plus, a Bose High End sound system, and the Power Seat package. It has 45k miles following registration history in California, and it was purchased by its current owner in March 2016.",,"Located in United States","2000s","106853342","false","Chassis: WP0CB29905S765435","45k Miles","3.8-Liter Flat-Six","Six-Speed Manual Transaxle","GT Silver Metallic Paint","Black Leather Upholstery","Black Soft Top","19″ Sport Design Wheels","Sport Chrono Package Plus","Bi-Xenon Headlights","Power Seat Package","Bose High End Sound System w/CD Stereo","Automatic Climate Control",,,,,,,,,,,,,,,,,,,"226394","Porsche 997 911 Carrera S","Porsche","false","Private Party","false","false","Bid to USD $37,250 <span> on 1/14/26 </span>","45k-Mile 2005 Porsche 911 Carrera S Cabriolet 6-Speed","0 Views"
"2026-01-14T18:30:20.000Z","January 14, 2026 at 10:30AM PT","37","59020","false","21037","1539","ended","https://bringatrailer.com/listing/1973-porsche-911t-coupe-40/","US","USA","USD","59020","USD $59,020","This 1973 Porsche 911T coupe was modified under prior ownership with fiberglass fender flares, an IROC-style rear spoiler, and custom bumpers. A 3.2L flat-six was also installed, and it is linked with a 915 five-speed manual transaxle. The car is finished in white, and it rides on 15&quot; Gotti wheels with Tarett Engineering and Bilstein suspension…","DJMRJD","Located in United States","1970s","107080021","false","Chassis: 9113103237","19k Miles Shown, TMU","3.2-Liter Flat-Six","915 Five-Speed Manual Transaxle","White Paint","Black & Red Microsuede Upholstery","Fiberglass Wide Bodywork","IROC-Style Rear Spoiler","15"" Gotti Wheels","Tarett Engineering & Bilstein Suspension","930-Specification Brake Calipers","Roll Bar","Schroth Seats w/Harnesses","Power Windows","Tag-Heuer Stopwatches","MOMO Steering Wheel",,,,,,,,,,,,,,,,"226375","Porsche LWB 911T (1969-1973)","Porsche","true","Dealer","false","true","Sold for USD $59,020 <span> on 1/14/26 </span>","IROC RSR-Style 1973 Porsche 911T Coupe 3.2L 5-Speed","0 Views"
"2026-01-13T20:39:38.000Z","January 13, 2026 at 12:39PM PT","25","143500","false","15247","1406","ended","https://bringatrailer.com/listing/2009-porsche-911-turbo-cabriolet-79/","US","USA","USD","143500","USD $143,500","This 2009 Porsche 911 Turbo cabriolet is said to have remained with its original owner until 2023 and has 140 miles. It was ordered in paint-to-sample silver over a beige leather-to-sample interior and is powered by a twin-turbocharged 3.6L flat-six that drives all four wheels via a five-speed Tiptronic S automatic transaxle.","AntonSportGarage","Located in United States","2000s","107374236","false","Chassis: WP0CD29909S773857","140 Miles","Twin-Turbocharged 3.6L Flat-Six","Five-Speed Automatic Transaxle","Paint-To-Sample Silver Paint","Leather-To-Sample Beige Upholstery","Black Soft Top","Removable Hardtop","19"" Champion Motorsports Wheels","Ceramic-Composite Brakes","Heated & Ventilated Front Seats","Thicker Leather Steering Wheel","PCM w/Navigation","Bose Sound System","Sport Chrono Package","Makassar Wood Trim","Aftermarket Exhaust System","Window Sticker",,,,,,,,,,,,,,"226347","Porsche 997 911 Turbo","Porsche","false","Dealer","false","false","Sold for USD $143,500 <span> on 1/13/26 </span>","140-Mile 2009 Porsche 911 Turbo Cabriolet","0 Views"
"2026-01-13T20:02:34.000Z","January 13, 2026 at 12:02PM PT","38","391000","false","14946","1499","ended","https://bringatrailer.com/listing/2025-porsche-911-gt3-rs-12/","US","USA","USD","391000","USD $391,000","This 2025 Porsche 911 GT3 RS was specified in Ice Gray Metallic over black leather and Race-Tex, and it was optioned with the weight-reducing Weissach Package which includes a carbon-composite roof panel, front lid, anti-roll bars, and interior trim. Additional options included an extended-range fuel tank, Porsche Ceramic Composite Brakes (PCCB),…",,"Located in United States","2020s","107296114","false","Chassis: WP0AF2A99SS278804","787 Miles","4.0-Liter Flat-Six","Extended-Range 23.7-Gallon Fuel Tank","Akrapovic Exhaust System","Seven-Speed PDK Dual-Clutch Automatic Transaxle","Electronically Locking Differential","Ice Gray Metallic Paint","Black Leather & Race-Tex Upholstery","Weissach Package","20"" & 21"" GT3 RS Magnesium Center-Lock Wheels","Porsche Ceramic Composite Brakes (PCCB)","Front-Axle Lift System","Rear-Axle Steering","LED-Matrix Headlights","Rear Wing","Carbon-Fiber Full Bucket Seats","Bose Sound System","Porsche Communication Management","Window Sticker","Clean Carfax Report",,,,,,,,,,,"226309","Porsche 992 911 GT3","Porsche","false","Private Party","false","false","Bid to USD $391,000 <span> on 1/13/26 </span>","2025 Porsche 911 GT3 RS Weissach","0 Views"
"2026-01-13T19:58:50.000Z","January 13, 2026 at 11:58AM PT","23","52000","false","9884","1264","ended","https://bringatrailer.com/listing/2009-porsche-911-carrera-4s-cabriolet-41/","US","USA","USD","52000","USD $52,000","This 2009 Porsche 911 Carrera 4S cabriolet was specified in GT Silver Metallic and optioned with the Sport Chrono, Infotainment, and Premium Packages. The car is powered by a 3.8-liter flat-six that drives all four wheels through a seven-speed PDK dual-clutch transaxle, and the interior is trimmed in black leather.","CD8","Located in United States","2000s","107149809","false","Chassis: WP0CB29909S756014","66k Miles","3.8-Liter Flat-Six","Seven-Speed PDK Dual-Clutch Automatic Transaxle","GT Silver Metallic Paint","Black Leather Upholstery","19” Carrera S II Wheels","Black Soft Top","Heated & Ventilated Front Seats","Automatic Climate Control","Bluetooth-Capable Pioneer Head Unit","Clean Carfax Report",,,,,,,,,,,,,,,,,,,,"226296","Porsche 997 911 Carrera 4S","Porsche","false","Dealer","false","false","Sold for USD $52,000 <span> on 1/13/26 </span>","2009 Porsche 911 Carrera 4S Cabriolet","0 Views"
"2026-01-13T19:45:41.000Z","January 13, 2026 at 11:45AM PT","36","49000","false","6790","814","ended","https://bringatrailer.com/listing/2003-porsche-911-carrera-cabriolet-92/","US","USA","USD","49000","USD $49,000","This 2003 Porsche 911 Carrera cabriolet was specified in Carrara White over Savanna Beige leather, and it was optioned with burl walnut wood interior trim. It has 36k miles following registration history in New York, North Carolina, Wisconsin, and Ohio. The car is powered by a 3.6-liter M96 flat-six paired with a six-speed manual transaxle, and…","gcliebig70","Located in United States","2000s","105162939","false","Chassis: WP0CA29973S653439","36k Miles","3.6-Liter M96 Flat-Six","Six-Speed Manual Transaxle","Carrara White Paint","Savanna Beige Leather Upholstery","Burl Walnut Wood Interior Trim","Blue Soft Top","Color-Matched Removable Hardtop","18″ Sport Classic Wheels","Porsche Stability Management","Deployable Rear Spoiler","Heated Power-Adjustable Front Seats","Bose Sound System","Becker Porsche CDR-23 Stereo & Remote CD Changer","Automatic Climate Control","Clean Carfax Report",,,,,,,,,,,,,,,"226248","Porsche 996 911 Carrera","Porsche","false","Dealer","false","false","Sold for USD $49,000 <span> on 1/13/26 </span>","36k-Mile 2003 Porsche 911 Carrera Cabriolet 6-Speed","0 Views"
"2026-01-13T19:08:39.000Z","January 13, 2026 at 11:08AM PT","57","184000","false","33370","2370","ended","https://bringatrailer.com/listing/1986-porsche-911-turbo-coupe-69/","US","USA","USD","184000","USD $184,000","This 1986 Porsche 911 Turbo coupe is finished in Meteor Metallic over Burgundy leather upholstery and is powered by a turbocharged 3.3-liter flat-six linked with a four-speed manual transaxle and limited-slip differential. Further equipment includes 16&quot; Fuchs alloy wheels, disc brakes, a sunroof, a tea-tray rear spoiler, and air conditioning along…","jimerl","Located in United States","1980s","105166379","false","Chassis: WP0JB0935GS051004","61k Miles Shown","Turbocharged 3.3-Liter Flat-Six","Four-Speed Manual Transaxle","Limited-Slip Differential","Meteor Metallic Paint","Burgundy Leather Upholstery","16"" Fuchs Alloy Wheels","Sunroof","Tea-Tray Rear Spoiler","Power-Adjustable Front Seats","Air Conditioning","Blaupunkt Stereo","MOMO Steering Wheel","Clean Carfax Report",,,,,,,,,,,,,,,,,"226290","Porsche 930 Turbo","Porsche","false","Dealer","false","false","Sold for USD $184,000 <span> on 1/13/26 </span>","1986 Porsche 911 Turbo Coupe","0 Views"
"2026-01-13T18:35:19.000Z","January 13, 2026 at 10:35AM PT","30","90500","false","14754","1694","ended","https://bringatrailer.com/listing/1987-porsche-911-carrera-coupe-109/","US","USA","USD","90500","USD $90,500","This 1988 Porsche 911 Carrera coupe was specified in Grand Prix White over Marine Blue leather upholstery, and shifting is through a G50 five-speed manual transaxle. Powered by a 3.2-liter flat-six, the car is equipped with 16″ Fuchs alloy wheels with body-color centers, a power-operated sunroof, power-adjustable front seats, an aftermarket…","Findus11","Located in United States","1980s","107193198","false","Chassis: WP0AB0915JS120148","135k Miles Shown","3.2-Liter Flat-Six","G50 Five-Speed Manual Transaxle","Grand Prix White Paint","Marine Blue Partial Leather Upholstery","16″ Fuchs Alloy Wheels","Sunroof","Power-Adjustable Front Seats","Aftermarket Stereo","Cruise Control","R134a-Based Air Conditioning","Power Windows","Service Records","Clean Carfax Report",,,,,,,,,,,,,,,,,"226241","Porsche 911 Carrera 3.2","Porsche","false","Private Party","false","false","Sold for USD $90,500 <span> on 1/13/26 </span>","1988 Porsche 911 Carrera Coupe G50","0 Views"
"2026-01-13T17:25:29.000Z","January 13, 2026 at 9:25AM PT","48","434000","false","29606","1866","ended","https://bringatrailer.com/listing/2019-porsche-911-speedster-94/","US","USA","USD","434000","USD $434,000","This 2019 Porsche 911 Speedster is #66 of 1,948 examples produced for the model year and was ordered with heated 18-way Adaptive Sport Seats Plus, a front-axle lift system, Bose audio, LED headlights with PDLS, and the Chrono and Light Design packages. The car is finished in Black over Black leather with Red stitching and is powered by a 4.0-liter…","krosen19","Located in United States","2010s","105289656","false","Chassis: WP0CF2A9XKS172466","#65 of 1,948 Produced","2,200 Miles","4.0-Liter Flat-Six","Six-Speed Manual Transaxle","Limited-Slip Differential","Black Paint w/PPF","Black Soft Top","Black Leather w/Red Stitching","Chrono & Light Design Packages","Satin Black 20"" GT3 Center-Lock Wheels","Porsche Ceramic Composite Brakes","Heated Adaptive Sport Seats Plus","Black LED Headlights w/PDLS","Extended-Range Fuel Tank","Front-Axle Lift System","Window Sticker","Literature & Records","Accident-Free Carfax Report",,,,,,,,,,,,,"226046","Porsche 991 911 Speedster","Porsche","false","Dealer","false","false","Sold for USD $434,000 <span> on 1/13/26 </span>","2,200-Mile 2019 Porsche 911 Speedster","0 Views"
"2026-01-12T19:51:02.000Z","January 12, 2026 at 11:51AM PT","30","169000","false","11144","1195","ended","https://bringatrailer.com/listing/2021-porsche-911-gt3-cup-3/","US","USA","USD","169000","USD $169,000","This 2021 Porsche 911 GT3 Cup is said to have been campaigned by a racing team in France before it was purchased by the seller in 2021 and brought to the US. The car features aluminum-steel composite bodywork finished in silver, and power comes from a 4.0-liter flat-six linked with a six-speed sequential transaxle and a limited-slip differential.",,"Located in United States","2020s","106710550","false","Chassis: WPOZZZ99ZMS298159","20k Kilometers (~12k Miles)","4.0L Flat-Six","Six-Speed Sequential Transaxle","Limited-Slip Differential","Magnetic Paddle Shifters","Silver Paint","Carbon Fiber Fixed Bucket Seats","Schroth Harnesses","Air Jack System","Fire Suppression System","Center-Lock 18"" Wheels","Padded Roll Cage w/Door Bars","Spare Wheels & Tires",,,,,,,,,,,,,,,,,,"226226","Porsche 992 911 GT3","Porsche","false","Private Party","false","false","Bid to USD $169,000 <span> on 1/12/26 </span>","2021 Porsche 911 GT3 Cup","0 Views"
"2026-01-12T19:06:54.000Z","January 12, 2026 at 11:06AM PT","30","28500","false","11303","1067","ended","https://bringatrailer.com/listing/2002-porsche-911-carrera-4s-coupe-43/","US","USA","USD","28500","USD $28,500","This 2002 Porsche 911 Carrera 4S coupe is finished in Seal Grey Metallic over Graphite Grey leather upholstery and is powered by a 3.6-liter flat-six that drives all four wheels through a five-speed Tiptronic automatic transaxle. Equipment includes a speed-activated rear spoiler, a sunroof, fog lights, 18″ Turbo-look wheels, heated…",,"Located in United States","2000s","105559887","false","Chassis: WP0AA299X2S622871","71k Miles","3.6-Liter Flat-Six","Five-Speed Tiptronic Automatic Transaxle","Seal Grey Metallic Paint","Graphite Grey Leather Upholstery","18″ Turbo-Look Wheels","Speed-Activated Rear Spoiler","Sunroof","Fog Lights","Heated Power-Adjustable Front Seats","Porsche Classic Communication Management (PCCM) System","Automatic Climate Control","Carfax Report",,,,,,,,,,,,,,,,,,"226175","Porsche 996 911 Carrera 4S","Porsche","false","Dealer","false","false","Bid to USD $28,500 <span> on 1/12/26 </span>","2002 Porsche 911 Carrera 4S Coupe","0 Views"
"2026-01-12T19:05:53.000Z","January 12, 2026 at 11:05AM PT","45","96000","false","14840","1674","ended","https://bringatrailer.com/listing/2008-porsche-911-turbo-cabriolet-168/","US","USA","USD","96000","USD $96,000","This 2008 Porsche 911 Turbo cabriolet has 37k miles, and it has spent most of its time registered in North Carolina, Georgia, and Florida. The car is finished in black over brown Natural leather, and factory options included the Sport Chrono Package, a thicker steering wheel, and heated power-adjustable front seats.","Luckyjda","Located in United States","2000s","107201455","false","Chassis: WP0CD29998S788548","37k Miles","Twin-Turbocharged 3.6L Flat-Six","Carbon-Fiber Air Box","Aftermarket Exhaust Headers","Six-Speed Manual Transaxle","Black Paint","Black Soft Top","Brown Natural Leather Upholstery","19” Turbo Wheels","Sport Chrono Package","Thicker Steering Wheel","Heated Power-Adjustable Front Seats","Porsche Communication Management w/Navigation","Bose Sound System w/Remote CD Changer","Automatic Climate Control","Clean Carfax Report",,,,,,,,,,,,,,,"226143","Porsche 997 911 Turbo","Porsche","false","Dealer","false","false","Sold for USD $96,000 <span> on 1/12/26 </span>","37k-Mile 2008 Porsche 911 Turbo Cabriolet 6-Speed","0 Views"
"2026-01-12T18:27:40.000Z","January 12, 2026 at 10:27AM PT","38","107000","false","13279","1055","ended","https://bringatrailer.com/listing/1987-porsche-911-carrera-coupe-108/","US","USA","USD","107000","USD $107,000","This 1987 Porsche 911 Carrera coupe was acquired by the current owner in 2020 and was subsequently modified in a 1970s IROC style by ROCS Design in Belleville, New Jersey. Finished in black over black upholstery, the car is powered by a 3.2-liter flat-six paired with a G50 five-speed manual transaxle.","pcb911guy","Located in United States","1980s","107072399","false","Chassis: WP0AB0910HS120620","45k Miles Shown, TMU","3.2-Liter Flat-Six","M&K Muffler","Steve Wong Chip","G50 Five-Speed Manual Transaxle","Black & Red Paint","Black Upholstery","KW V3 Dampers","16″ Fuchs Evolution Wheels","Front Splitter","Fiberglass Bumper Covers","Widened Fenders","993 Side Mirrors","Power Sunroof","Whale-Tail Spoiler","Cobra Bucket Seats","MOMO Steering Wheel","WEVO Shifter","AC, Console, & Rear Seat Deletes","Aluminum Floorboards & Pedal Covers","RS-Style Door Panels","Power Windows","PCCM Stereo","2025 Leak-Down Results","Owner's Manual",,,,,,"226121","Porsche 911 Carrera 3.2","Porsche","false","Private Party","false","false","Sold for USD $107,000 <span> on 1/12/26 </span>","Modified 1987 Porsche 911 Carrera Coupe G50","0 Views"
"2026-01-12T18:24:00.000Z","January 12, 2026 at 10:24AM PT","29","42000","false","15323","1397","ended","https://bringatrailer.com/listing/2008-porsche-911-carrera-coupe-22/","US","USA","USD","42000","USD $42,000","This 2008 Porsche 911 Carrera coupe is finished in Basalt Black Metallic over Sand Beige leather, and it now has 49k miles. Powered by a 3.6-liter flat-six paired with a five-speed Tiptronic S automatic transaxle. Equipment includes 19&quot; Carrera Sport wheels, a deployable rear spoiler, a sunroof, heated power-adjustable front seats, a Bose sound…","AirportXNA","Located in United States","2000s","106742086","false","Chassis: WP0AA299X8S710571","49k Miles","3.6-Liter Flat-Six","5-Speed Automatic Transaxle","Basalt Black Metallic Paint","Sunroof","Sand Beige Leather Upholstery","19"" Carrera Sport Wheels","PCM","Heated & Powered Front Seats","Bose Sound System","Automatic Climate Control","Cruise Control","Clean Carfax Report",,,,,,,,,,,,,,,,,,"226132","Porsche 997 911 Carrera","Porsche","false","Dealer","false","false","Sold for USD $42,000 <span> on 1/12/26 </span>","49k-Mile 2008 Porsche 911 Carrera Coupe","0 Views"
"2026-01-10T18:05:01.000Z","January 10, 2026 at 10:05AM PT","37","44500","false","20478","1321","ended","https://bringatrailer.com/listing/2004-porsche-911-carrera-4s-cabriolet-37-2/","US","USA","USD","44500","USD $44,500","This 2004 Porsche 911 Carrera 4S cabriolet is finished in Midnight Blue Metallic over Graphite Grey full-leather upholstery, and it is powered by a 3.6-liter flat-six that drives all four wheels through a six-speed manual transaxle. Equipment includes a removable body-color hardtop, a powered Metropol Blue soft top, xenon headlights, a…","mwinnc","Located in United States","2000s","105720783","false","Chassis: WP0CA29904S652053","24k Miles","3.6-Liter Flat-Six","Six-Speed Manual Gearbox","All-Wheel Drive","Midnight Blue Metallic Paint","Graphite Grey Full Leather Upholstery","Power-Operated Metropol Blue Soft Top","Removable Body-Color Hardtop","18"" Turbo-Look Wheels","Xenon Headlights","Heated & Powered Front Seats","Automatic Climate Control","Porsche CDR23 Stereo & CD Changer","Cruise Control","Clean Carfax Report",,,,,,,,,,,,,,,,"226078","Porsche 996 911 Carrera 4S","Porsche","false","Dealer","false","false","Sold for USD $44,500 <span> on 1/10/26 </span>","24k-Mile 2004 Porsche 911 Carrera 4S Cabriolet 6-Speed","0 Views"
"2026-01-08T20:18:34.000Z","January 8, 2026 at 12:18PM PT","20","42000","false","17956","1520","ended","https://bringatrailer.com/listing/2007-porsche-911-carrera-coupe-36/","US","USA","USD","42000","USD $42,000","This 2007 Porsche 911 Carrera coupe is finished in Black over Sand Beige Standard leather and is equipped with a PCCM+ infotainment system, bi-xenon headlights, 18&quot; Carrera III wheels, heated front seats, and the Power Seat and Bose High End Sound packages. Power is provided by a 3.6-liter flat-six paired with a six-speed manual transaxle.","Mattwayne","Located in United States","2000s","107040789","false","Chassis: WP0AA29947S710838","89k Miles","3.6-Liter Flat-Six","Six-Speed Manual Transaxle","Black Paint","Sand Beige Standard Leather","Power Seat & Bose High End Sound Packs","PCCM+ Infotainment System","18"" Carrera III Wheels","Bi-Xenon Headlights","Heated Seats",,,,,,,,,,,,,,,,,,,,,"226031","Porsche 997 911 Carrera","Porsche","false","Private Party","false","false","Sold for USD $42,000 <span> on 1/8/26 </span>","2007 Porsche 911 Carrera Coupe 6-Speed","0 Views"
"2026-01-08T19:54:00.000Z","January 8, 2026 at 11:54AM PT","36","118000","false","16694","1497","ended","https://bringatrailer.com/listing/2018-porsche-911-turbo-coupe-14/","US","USA","USD","118000","USD $118,000","This 2017 Porsche 911 Turbo is a black-over-black coupe has been registered in Georgia from new, and 8k of the 29k miles have been added since the car was purchased by the current owner as a Porsche Approved certified pre-owned vehicle in November 2023. Power is from a twin-turbocharged 3.8L flat-six that drives all four wheels through a…","Msargent17","Located in United States","2010s","104603348","false","Chassis: WP0AD2A98HS167319","29k Miles","Twin-Turbocharged 3.8L Flat-Six","Seven-Speed PDK Dual-Clutch Transaxle","Electronic Limited-Slip Rear Differential","Black Paint","Black Leather Upholstery","20"" Split-Spoke Alloy Wheels","Power Steering Plus","LED Headlights w/Porsche Dynamic Light System PLUS","SportDesign Side Mirrors","Porsche Entry & Drive","Heated & Ventilated Power-Adjustable Front Seats","Lane Change Assist","Bose Sound System","Automatic Climate Control",,,,,,,,,,,,,,,,"226024","Porsche 991 911 Turbo","Porsche","false","Private Party","false","false","Sold for USD $118,000 <span> on 1/8/26 </span>","29k-Mile 2017 Porsche 911 Turbo Coupe","0 Views"
"2026-01-08T18:33:17.000Z","January 8, 2026 at 10:33AM PT","67","301000","false","37715","2624","ended","https://bringatrailer.com/listing/1973-porsche-911-carrera-rs-touring-9/","US","USA","USD","301000","USD $301,000","This 1973 Porsche 911 Carrera RS is one of 1,580 examples produced and was specified from the factory finished in Sepia Brown in M472 Touring specification with a 2.7-liter flat-six. Chassis 1452 is said to have undergone a color change to white in the 1970s as well as a displacement increase to 2.8 liters in the 1980s while with an owner in…",,"Located in United States","1970s","105727299","false","Chassis: 9113601452","77k Kilometers (~48k Miles) Shown","2.9-Liter Flat-Six","915 Five-Speed Manual Transaxle","Repainted White w/Red RS Graphics","Black Leather Upholstery","15"" Fuchs Alloy Wheels","Bilstein Shocks","MOMO Steering Wheel","Bolstered Recaro Bucket Seats","TRW Sabelt Harnesses","Roll Bar","Coated Center-Exit Exhaust System","2025 Refurbishment Totaling $140k",,,,,,,,,,,,,,,,,,"225681","Porsche 911 Carrera RS (1973)","Porsche","false","Private Party","false","false","Bid to USD $301,000 <span> on 1/8/26 </span>","2.9L-Powered Porsche 911 Carrera RS Touring","0 Views"
"2026-01-08T18:08:57.000Z","January 8, 2026 at 10:08AM PT","43","341888","false","27375","1860","ended","https://bringatrailer.com/listing/2024-porsche-911-gt3-rs-59/","US","USA","USD","341888","USD $341,888","This 2024 Porsche 911 GT3 RS is finished in Guards Red with white graphics, and its carbon-fiber full bucket seats are trimmed in black leather and Race-Tex upholstery. Power is provided by a 4.0-liter flat-six that drives the rear wheels through a seven-speed PDK dual-clutch automatic transaxle, and the car is equipped with an electronically…","Psoomekh","Located in United States","2020s","107007520","false","Chassis: WP0AF2A98RS272342","7k Miles","4.0-Liter Flat-Six","Seven-Speed PDK Dual-Clutch Automatic Transaxle","Electronically Locking Differential","Guards Red Paint","Black Leather & Race-Tex Upholstery","20"" and 21"" Forged Lightweight Aluminum Wheels","Rear Wing","Front-Axle Lift","Carbon-Fiber Full Bucket Seats","Bose Sound System","LED Headlights w/PDLS",,,,,,,,,,,,,,,,,,,"225972","Porsche 992 911 GT3","Porsche","false","Dealer","false","false","Sold for USD $341,888 <span> on 1/8/26 </span>","2024 Porsche 911 GT3 RS","0 Views"
"2026-01-07T21:06:28.000Z","January 7, 2026 at 1:06PM PT","58","98500","false","33588","2362","ended","https://bringatrailer.com/listing/1985-porsche-911-carrera-coupe-67/","US","USA","USD","98500","USD $98,500","This 1985 Porsche 911 Carrera coupe was specified with the M491 “Turbo Look” package and is powered by a 3.2-liter flat-six linked with a 915 five-speed manual transaxle. It is finished in black over black leather and has a sunroof, a Fabspeed muffler, and 16” BBS wheels as well as a MOMO steering wheel, a Blaupunkt CD stereo, cruise…",,"Located in United States","1980s","106988547","false","Chassis: WP0AB0910FS120789","74k Miles Shown, TMU","3.2-Liter Flat-Six","915 Five-Speed Manual Transaxle","Black Paint","Black Leather Upholstery","M491 “Turbo Look” Package","16"" BBS Wheels","Sunroof","Fabspeed Muffler","MOMO Steering Wheel","Power-Adjustable Front Seats","Blaupunkt CD Stereo","Air Conditioning","Cruise Control",,,,,,,,,,,,,,,,,"225967","Porsche 911 Carrera 3.2","Porsche","false","Dealer","false","false","Bid to USD $98,500 <span> on 1/7/26 </span>","1985 Porsche 911 Carrera Coupe M491","0 Views"
"2026-01-07T20:50:24.000Z","January 7, 2026 at 12:50PM PT","47","146000","false","18901","1325","ended","https://bringatrailer.com/listing/2016-porsche-911-gt3-rs-100/","US","USA","USD","146000","USD $146,000","This 2016 Porsche 911 GT3 RS left the factory in GT Silver Metallic over black leather and Silver Gray Alcantara, and factory options included the Sport Chrono Package, the Light Design Package, 20&quot; and 21&quot; center-lock alloy wheels, a front-axle lift system, Porsche Ceramic Composite Brakes, an extended-range fuel tank, and xenon headlights with…",,"Located in United States","2010s","107285711","false","Chassis: WP0AF2A9XGS187287","13k Miles","4.0-Liter Flat-Six","Extended-Range Fuel Tank","Seven-Speed PDK Dual-Clutch Transaxle","Porsche Torque Vectoring Plus","GT Silver Metallic Paint","Black Leather & Silver Gray Alcantara Upholstery","20"" & 21"" Center-Lock Alloy Wheels","Porsche Ceramic Composite Brakes","Front-Axle Lift System","Sport Chrono Package","Light Design Package","Xenon Headlights w/Porsche Dynamic Lighting System (PDLS)","Rear Wing","Carbon-Fiber-Backed Bucket Seats","PCM w/Navigation",,,,,,,,,,,,,,,"225932","Porsche 991 911 GT3","Porsche","false","Dealer","false","false","Bid to USD $146,000 <span> on 1/7/26 </span>","13k-Mile 2016 Porsche 911 GT3 RS","0 Views"
"2026-01-07T18:50:59.000Z","January 7, 2026 at 10:50AM PT","18","71000","false","19954","1449","ended","https://bringatrailer.com/listing/1976-porsche-911-carrera-3-0-targa-4/","US","USA","USD","71000","USD $71,000","This 1976 Porsche 911 Carrera is one of 479 Targa examples equipped with a 3.0-liter flat-six for the model year. The car was sold new in Bremen, Germany, imported to the US in the 1980s, and exported in 2013 to Norway, where it spent time before it was listed on BaT in June 2024. It was subsequently acquired by the current owner and reimported to…",,"Located in United States","1970s","107151477","false","Chassis: 9116610426","226k Kilometers (~141k Miles) Shown","3.0-Liter Flat-Six","Type 915 Five-Speed Manual Transaxle","Black Paint","Gold Carrera Graphics","Black Upholstery","Black Targa Bar","Removable Roof Panel","15"" Fuchs Wheels","Continental Bluetooth Stereo","Tool Roll","Manufacturer's Literature",,,,,,,,,,,,,,,,,,,"225876","Porsche 911 1974-1977","Porsche","false","Dealer","false","false","Bid to USD $71,000 <span> on 1/7/26 </span>","RoW 1976 Porsche 911 Carrera 3.0 Targa","0 Views"
"2026-01-07T18:24:05.000Z","January 7, 2026 at 10:24AM PT","62","63500","false","23300","2219","ended","https://bringatrailer.com/listing/2007-porsche-911-carrera-s-coupe-80/","US","USA","USD","63500","USD $63,500","This 2007 Porsche 911 Carrera S coupe has 44k miles following registration history in Texas and Arizona, and it was optioned with a six-speed manual transaxle, which is paired with a 3.8-liter flat-six. Finished in Slate Gray Metallic over Stone Gray leather, the car is equipped with the Bose High-End Sound Package, 19″ Carrera S wheels, a…","MattyGatch","Located in United States","2000s","106934282","false","Chassis: WP0AB29967S731171","44k Miles","3.8-Liter Flat-Six","Six-Speed Manual Transaxle","Slate Gray Metallic Paint","Stone Gray Leather Upholstery","19″ Carrera S Wheels","Sunroof","Heated Power-Adjustable Front Seats","Bose Sound System","PCM w/Navigation",,,,,,,,,,,,,,,,,,,,,"225881","Porsche 997 911 Carrera S","Porsche","false","Private Party","false","false","Sold for USD $63,500 <span> on 1/7/26 </span>","44k-Mile 2007 Porsche 911 Carrera S Coupe 6-Speed","0 Views"
"2026-01-06T21:31:51.000Z","January 6, 2026 at 1:31PM PT","60","250000","false","24848","1929","ended","https://bringatrailer.com/listing/1997-porsche-911-carrera-4s-120/","US","USA","USD","250000","USD $250,000","This 1997 Porsche 911 Carrera 4S is a German-market example that is finished in Viola Metallic over Classic Gray leather and now has 57k kilometers (~35k miles). The car is powered by a 3.6-liter flat-six that drives all four wheels through a six-speed manual transaxle with a limited-slip differential.",,"Located in United States","1990s","107154809","false","Chassis: WP0ZZZ99ZVS311937","57k Kilometers (~35k Miles)","3.6-Liter Flat-Six","Six-Speed Manual Transaxle","Limited-Slip Differential","Viola Metallic","Classic Gray Leather","18″ Turbo Twist Wheels","X79 Rear-Fender Air Inlets","Power-Operated Sunroof","Fixed Rear Spoiler","Becker Stereo","Air Conditioning","Cruise Control","Heated Front Seats","Clean Carfax Report",,,,,,,,,,,,,,,,"225874","Porsche 993 911 (Non-Turbo/GT2)","Porsche","false","Dealer","false","false","Bid to USD $250,000 <span> on 1/6/26 </span>","57k-Kilometer RoW 1997 Porsche 911 Carrera 4S 6-Speed","0 Views"
"2026-01-06T21:31:14.000Z","January 6, 2026 at 1:31PM PT","28","137500","false","11535","1213","ended","https://bringatrailer.com/listing/2018-porsche-911-carrera-gts-coupe-19/","US","USA","USD","137500","USD $137,500","This 2018 Porsche 911 Carrera GTS coupe has 14k miles and was specified in Chalk over a black leather and Alcantara interior, which houses heated adaptive sport seats. Powered by a twin-turbocharged 3.0L flat-six paired with a seven-speed PDK dual-clutch automatic transaxle, the car was optioned with the Sport Chrono Package, a front axle lift…","Elh0mbre","Located in United States","2010s","106868242","false","Chassis: WP0AB2A9XJS122619","14k Miles","Twin-Turbocharged 3.0-Liter Flat-Six","Seven-Speed PDK Dual-Clutch Automatic Transaxle","Limited-Slip Differential","Chalk Paint","Black Leather & Alcantara Upholstery","20"" Turbo S Center-Lock Alloy Wheels","Sport Chrono Package","Front Axle Lift System","Power Steering Plus","Porsche Torque Vectoring","Xenon Headlights w/PDLS","Speed-Activated Rear Spoiler","ParkAssist","Bose Sound System","Heated Steering Wheel","Heated Adaptive Sport Seats","Carbon-Fiber Interior Trim","Dual-Zone Automatic Climate Control","Clean Carfax Report",,,,,,,,,,,"225865","Porsche 991 911 Carrera GTS","Porsche","false","Private Party","false","false","Sold for USD $137,500 <span> on 1/6/26 </span>","2018 Porsche 911 Carrera GTS Coupe","0 Views"
"2026-01-06T21:23:56.000Z","January 6, 2026 at 1:23PM PT","45","396000","false","16964","1441","ended","https://bringatrailer.com/listing/2025-porsche-911-gt3-rs-10/","US","USA","USD","396000","USD $396,000","This 2025 Porsche 911 GT3 RS has 19 miles and was optioned from the factory with the Weissach Package, which reduced weight by utilizing a carbon-composite roof panel, front lid, anti-roll bars, and interior trim. Its body is finished in Arctic Gray with red graphics, and power is provided by a 4.0-liter flat-six that drives the rear wheels…","xia0w0ng","Located in United States","2020s","105000720","false","Chassis: WP0AF2A96SS279408","19 Miles","4.0-Liter Flat-Six","Seven-Speed PDK Dual-Clutch Automatic Transaxle","Electronically Locking Differential","Arctic Gray Paint w/Red Accents","Black Leather and Race-Tex Upholstery","20"" and 21"" GT3 RS Lightweight Magnesium Center-Lock Wheels","Weissach Package","Front-Axle Lift","Porsche Ceramic Composite Brakes","Carbon-Fiber Full Bucket Seats","Bose Sound System","Window Sticker","Total Price of $326k in 2025","Clean Carfax Report",,,,,,,,,,,,,,,,"225867","Porsche 992 911 GT3","Porsche","false","Dealer","false","false","Sold for USD $396,000 <span> on 1/6/26 </span>","2025 Porsche 911 GT3 RS Weissach","0 Views"
"2026-01-06T20:45:28.000Z","January 6, 2026 at 12:45PM PT","34","132000","false","23862","2083","ended","https://bringatrailer.com/listing/1971-porsche-911t-coupe-24/","US","USA","USD","132000","USD $132,000","This 1971 Porsche 911T coupe was modified in RS-style over the course of three years by RS Werks of Newark, Delaware, including the installation of steel fender flares, fiberglass bumpers, and a 3.2L flat-six. The build was completed in 2018 and also involved repainting the car in Albert Blue as well as installing RSR-style 15&quot; Fuchs alloy wheels,…","Jockr","Located in United States","1970s","106572987","false","Chassis: 9111121297","6k Miles Shown on Build","3.2-Liter Flat-Six","Five-Speed Manual Transaxle","Repainted Albert Blue","Black Upholstery w/Houndstooth Inserts","15"" Fuchs Alloy Wheels","Bilstein Shocks","Adjustable Sway Bars","Turbo Tie Rods","Rear Fender Flares","GTS Classics Seats","MOMO Steering Wheel","JWest Shifter","SSI Exhaust",,,,,,,,,,,,,,,,,"225868","Porsche LWB 911T (1969-1973)","Porsche","false","Dealer","false","false","Sold for USD $132,000 <span> on 1/6/26 </span>","RS-Style 1971 Porsche 911T Coupe 3.2L 5-Speed","0 Views"
"2026-01-06T19:42:00.000Z","January 6, 2026 at 11:42AM PT","4","300000","false","17126","1351","ended","https://bringatrailer.com/listing/2018-porsche-911-gt3-171/","US","USA","USD","300000","USD $300,000","This 2018 Porsche 911 GT3 has 196 miles through the seller&#039;s purchase in 2025, and it is powered by a 4.0-liter flat-six paired with a six-speed manual transaxle. Finished in Carrara White Metallic over black leather and Alcantara upholstery, the car is equipped with the Sport Chrono Package, 20&quot; center-lock alloy wheels, Porsche Ceramic…","josefbacik","Located in United States","2010s","106649175","false","Chassis: WP0AC2A95JS174446","196 Miles","4.0-Liter Flat-Six","Six-Speed Manual Transaxle","Carrara White Metallic Paint","Black Leather and Alcantara Upholstery","Satin Black 20"" Center-Lock Alloy Wheels","Porsche Ceramic Composite Brakes","Front-Axle Lift","Carbon-Fiber Full Bucket Seats","Bose Sound System","PCM w/Navigation","Sport Chrono Package","Clean Carfax Report",,,,,,,,,,,,,,,,,,"225873","Porsche 991 911 GT3","Porsche","false","Private Party","false","false","Sold for USD $300,000 <span> on 1/6/26 </span>","196-Mile 2018 Porsche 911 GT3 6-Speed","0 Views"
"2026-01-06T18:43:24.000Z","January 6, 2026 at 10:43AM PT","33","38500","false","19857","1859","ended","https://bringatrailer.com/listing/2007-porsche-911-carrera-s-coupe-77/","US","USA","USD","38500","USD $38,500","This 2007 Porsche 911 Carrera S coupe is finished in Atlas Gray Metallic over Stone Gray leather and is powered by a 3.8-liter flat-six paired with a six-speed manual transaxle. Features include heated Sport bucket seats, a Sport shifter, 19&quot; Carrera Classic wheels, a sunroof, and PASM dampers.","mynewride1979","Located in United States","2000s","105091074","false","Chassis: WP0AB299X7S730430","115k Miles","3.8-Liter Flat-Six","Six-Speed Manual Transaxle","Atlas Gray Metallic Paint","Stone Gray Leather","Sport Shifter","PASM Dampers","Heated Front Sport Seats","19"" Carrera Classic Wheels","Clean Carfax Report",,,,,,,,,,,,,,,,,,,,,"225795","Porsche 997 911 Carrera S","Porsche","false","Dealer","false","false","Sold for USD $38,500 <span> on 1/6/26 </span>","2007 Porsche 911 Carrera S Coupe 6-Speed","0 Views"
"2026-01-06T18:16:59.000Z","January 6, 2026 at 10:16AM PT","31","246000","false","20969","1803","ended","https://bringatrailer.com/listing/2022-porsche-911-gt3-touring-138/","US","USA","USD","246000","USD $246,000","This 2022 Porsche 911 GT3 Touring is powered by a 4.0-liter flat-six that drives the rear wheels through a six-speed manual transaxle with a mechanical limited-slip differential and is finished in Dolomite Silver Metallic over black upholstery. Equipment includes the Chrono package, a front-axle lift system, ceramic-composite brakes, LED…","Supertrofeo","Located in United States","2020s","106728339","false","Chassis: WP0AC2A93NS269562","16k Miles","4.0-Liter Flat-Six","Six-Speed Manual Transaxle","Dolomite Silver Metallic Paint","Black Upholstery","Touring Package in Black","Chrono Package","20"" and 21"" GT3 Center-Lock Wheels","Porsche Ceramic Composite Brakes w/High Gloss Black Calipers","Front-Axle Lift","LED Headlights w/PDLS","Heated 18-Way Adaptive Sport Plus Seats","Bose Sound System","Total Price of $194k in 2022","Window Sticker","Clean Carfax Report",,,,,,,,,,,,,,,"225819","Porsche 992 911 GT3","Porsche","false","Private Party","false","false","Sold for USD $246,000 <span> on 1/6/26 </span>","2022 Porsche 911 GT3 Touring 6-Speed","0 Views"
"2026-01-06T18:15:03.000Z","January 6, 2026 at 10:15AM PT","40","205000","false","29860","2318","ended","https://bringatrailer.com/listing/1994-porsche-911-carrera-4-widebody-27/","US","USA","USD","205000","USD $205,000","This 1994 Porsche 911 Carrera 4 is one of 267 factory widebody coupes delivered to the North American market. Finished in Guards Red over black leather, the car is powered by a 3.6-liter flat-six that drives all four wheels through a five-speed manual transaxle and a limited-slip rear differential. Equipment includes Web Cam camshafts, an…","mgoblue071","Located in United States","1990s","107169371","false","Chassis: WP0AB2967RS420096","126k Miles Shown","3.6-Liter Flat-Six","Web Cam Camshafts","Aftermarket Muffler","Five-Speed Manual Transaxle","All-Wheel Drive","Guards Red Paint","Black Leather","Eibach Springs & Bilstein Dampers","Antilock Disc Brakes","17"" Cup Wheels","Deployable Rear Spoiler","Air Conditioning","Cruise Control","Power Windows","Sony Stereo","Reconditioning Photos","Recent Service Records","Clean Carfax Report",,,,,,,,,,,,"225774","Porsche 964 911 (Non-Turbo)","Porsche","false","Dealer","false","false","Sold for USD $205,000 <span> on 1/6/26 </span>","1994 Porsche 911 Carrera 4 Widebody 5-Speed","0 Views"
"2026-01-05T19:52:50.000Z","January 5, 2026 at 11:52AM PT","36","62000","false","9382","1222","ended","https://bringatrailer.com/listing/1979-porsche-911sc-targa-65/","US","USA","USD","62000","USD $62,000","This 1979 Porsche 911SC is a Guards Red-finished Targa that was purchased by the seller in 2003. The car is powered by a 3.0-liter flat-six paired with a five-speed manual transaxle, and the interior is trimmed in black leather upholstery. Equipment includes 16&quot; Fuchs alloy wheels, a removable roof panel, fog lights, power windows, and a Clarion…","Kaeden","Located in United States","1970s","106803419","false","Chassis: 9119211921","61k Miles Shown on Repaired Odometer","3.0-Liter Flat-Six","Five-Speed Manual Transaxle","Guards Red Paint","Black Leather Upholstery","16"" Fuchs Wheels","Removable Roof Panel","Fog Lights","Power Windows","Clarion Head Unit","Service Records & Manufacturer's Literature",,,,,,,,,,,,,,,,,,,,"225758","Porsche 911SC","Porsche","false","Private Party","false","false","Sold for USD $62,000 <span> on 1/5/26 </span>","22-Years-Owned 1979 Porsche 911SC Targa","0 Views"
"2026-01-05T19:33:30.000Z","January 5, 2026 at 11:33AM PT","22","68000","false","17693","1977","ended","https://bringatrailer.com/listing/1979-porsche-911sc-109/","US","USA","USD","68000","USD $68,000","This 1979 Porsche 911SC coupe was registered with its previous owner in California from 1994 until it was acquired by the selling dealer in 2025, and subsequent refurbishments included refurbishing the interior with Cork upholstery with plaid cloth inserts, installing replacement black square-weave carpeting, and trimming the upper dashboard, door…",,"Located in United States","1970s","106902365","false","Chassis: 9119200243","172k Miles Shown","3.0-Liter Flat-Six","Five-Speed Manual Transaxle","Talbot Yellow Paint","Cork Upholstery w/Plaid Inserts","16"" Fuchs Alloy Wheels","Sunroof","H4 Headlights","Bumper-Mounted Oil Cooler Intake","Leather-Wrapped Steering Wheel","Power Windows","CD Stereo w/Bluetooth","California Emissions Equipment","Service Records",,,,,,,,,,,,,,,,,"225733","Porsche 911SC","Porsche","false","Dealer","false","false","Bid to USD $68,000 <span> on 1/5/26 </span>","1979 Porsche 911SC Coupe","0 Views"
"2026-01-05T19:30:10.000Z","January 5, 2026 at 11:30AM PT","33","131000","false","18655","1443","ended","https://bringatrailer.com/listing/2014-porsche-911-turbo-s-cabriolet-15/","US","USA","USD","131000","USD $131,000","This 2014 Porsche 911 Turbo S Cabriolet is finished in paint-to-sample Pastel Orange over Black leather with orange stitching and was ordered with LED headlights, clear glass taillights, additional orange interior details, and heated and ventilated Adaptive Sport Seats Plus. The car was sold new at Porsche of San Diego in California and now has…",,"Located in United States","2010s","106477590","false","Chassis: WP0CD2A95ES173602","28k Miles","Twin-Turbocharged 3.8L Flat-Six","Seven-Speed PDK Transaxle","Locking Rear Differential","Paint-to-Sample Pastel Orange","Black Leather w/Orange Stitching","Sport Chrono & Light Design Packages","Porsche Ceramic Composite Brakes","20"" Turbo S Center-Lock Wheels","Power-Operated Black Soft Top","Clear Glass Taillights","Clean Carfax Report",,,,,,,,,,,,,,,,,,,"225729","Porsche 991 911 Turbo","Porsche","false","Dealer","false","false","Bid to USD $131,000 <span> on 1/5/26 </span>","Pastel Orange 2014 Porsche 911 Turbo S Cabriolet","0 Views"
"2026-01-05T18:48:54.000Z","January 5, 2026 at 10:48AM PT","77","120000","false","32366","2219","ended","https://bringatrailer.com/listing/1995-porsche-911-carrera-coupe-135/","US","USA","USD","120000","USD $120,000","This 1995 Porsche 911 Carrera coupe was registered in Texas, Florida, Colorado, and California before it was sold on BaT in August 2019, and it was acquired by the current owner in 2020. Powered by a 3.6-liter flat-six paired with a six-speed manual transaxle, the car is finished in Guards Red over Cashmere Beige leather.","posvar","Located in United States","1990s","106999345","false","Chassis: WP0AA2990SS321347","109k Miles Shown","3.6-Liter Flat-Six","Six-Speed Manual Transaxle","Guards Red Paint","Tan Leather Upholstery","18″ Turbo Twist Wheels","Eibach Springs","RS-Style Front Spoiler","Motor Sound Package Airbox","Xenon Headlights","Power-Adjustable Front Seats","Porsche Becker CD Stereo","Air Conditioning","Cruise Contol","Sisal Floor Mats","Clean Carfax Report",,,,,,,,,,,,,,,"225684","Porsche 993 911 (Non-Turbo/GT2)","Porsche","false","Dealer","true","false","Sold for USD $120,000 <span> on 1/5/26 </span>","1995 Porsche 911 Carrera Coupe 6-Speed","0 Views"
"2026-01-05T18:16:37.000Z","January 5, 2026 at 10:16AM PT","22","23750","false","11879","945","ended","https://bringatrailer.com/listing/1999-porsche-911-carrera-4-cabriolet-16/","US","USA","USD","23750","USD $23,750","This 1999 Porsche 911 Carrera 4 cabriolet is powered by a replacement 3.4-liter M96 flat-six that drives all four wheels through a six-speed manual transaxle. It is finished in Ocean Blue Metallic over Graphite Grey leather and is equipped with Bilstein coilovers as well as a speed-activated rear spoiler, a body-color removable hardtop, a blue…","SteveGFL","Located in United States","1990s","106606798","false","Chassis: WP0CA2998XS654637","113k Miles","Replacement 3.4-Liter M96 Flat-Six","Six-Speed Manual Transaxle","Ocean Blue Metallic Paint","Graphite Grey leather Upholsetry","Blue Soft Top","Removable Hardtop","18″ Sport Classic Wheels","Bilstein Coilovers","Heated Power-Adjustable Front Seats","Hi-Fi Sound System","Porsche Community Management 1 w/Navigation","Service Records","Hardtop Stand & Car Cover","Clean Carfax Report",,,,,,,,,,,,,,,,"225670","Porsche 996 911 Carrera 4","Porsche","true","Private Party","false","true","Sold for USD $23,750 <span> on 1/5/26 </span>","1999 Porsche 911 Carrera 4 Cabriolet 6-Speed","0 Views"
"2026-01-02T19:50:51.000Z","January 2, 2026 at 11:50AM PT","29","300000","false","16276","1266","ended","https://bringatrailer.com/listing/2023-porsche-911-turbo-s-coupe-24/","US","USA","USD","300000","USD $300,000","This 2023 Porsche 911 Turbo S coupe was ordered with approximately $60k in options, some of which include a paint-to-sample Porsche Racing Green Metallic exterior finish in addition to the Heritage Design and SportDesign packages. It has 2,200 miles and is powered by a twin-turbocharged 3.7L flat-six linked with an eight-speed PDK dual-clutch…","DonnieE","Located in United States","2020s","106524132","false","Chassis: WP0AD2A92PS257547","2,200 Miles","Twin-Turbocharged 3.7L Flat-Six","Eight-Speed PDK Dual-Clutch Automatic Transaxle","Paint-to-Sample Porsche Racing Green Metallic","Cognac Leather and Pepita-Style Cloth Upholstery","20"" and 21"" Turbo S Exclusive Design Alloy Wheels","Sport Chrono Package","Sport Exhaust","Heritage Design and SportDesign Packages","Porsche Ceramic Composite Brakes","Front-Axle Lift","Heated Power-Adjustable Front Seats","Power Steering Plus","High-End Burmester Sound System","Total Price of $277k in 2023","Clean Carfax Report",,,,,,,,,,,,,,,"225628","Porsche 992 911 Turbo","Porsche","true","Private Party","false","true","Sold for USD $300,000 <span> on 1/2/26 </span>","2023 Porsche 911 Turbo S Coupe","0 Views"
"2026-01-02T19:35:13.000Z","January 2, 2026 at 11:35AM PT","40","76076","false","15229","1188","ended","https://bringatrailer.com/listing/2016-porsche-911-carrera-coupe-8/","US","USA","USD","76076","USD $76,076","This 2016 Porsche 911 Carrera coupe is finished in Lava Orange over Black Standard leather and is powered by a 3.4-liter flat-six paired with a seven-speed PDK transaxle. Equipment includes the Premium, Bose Audio, and Sport Chrono packages as well as a Fabspeed exhaust, 19&quot; Carrera wheels, clear taillights, a sunroof, heated power-adjustable…","Touch0fRed","Located in United States","2010s","106994212","false","Chassis: WP0AA2A95GS106792","45k Miles","3.4-Liter Flat-Six","Fabspeed Motorsport Exhaust","Seven-Speed PDK Transaxle","Lava Orange Paint","Black Standard Leather","Premium & Bose Audio Packages","Sport Chrono Package","Power Sunroof","Clear Taillights","19"" Carrera Wheels","Xenon Headlights w/PDLS","Heated & Powered Front Seats","Build List & Service Records","Clean Carfax Report",,,,,,,,,,,,,,,,"225613","Porsche 991 911 Carrera","Porsche","false","Private Party","false","false","Sold for USD $76,076 <span> on 1/2/26 </span>","2016 Porsche 911 Carrera Coupe","0 Views"
"2026-01-02T19:22:38.000Z","January 2, 2026 at 11:22AM PT","27","68000","false","16738","1708","ended","https://bringatrailer.com/listing/2009-porsche-911-carrera-4s-coupe-29/","US","USA","USD","68000","USD $68,000","This 2009 Porsche 911 Carrera 4S coupe is powered by a 3.8-liter flat-six that drives all four wheels through a six-speed manual transaxle and is finished in Arctic Silver Metallic over black leather. Equipment includes the Sport Chrono Package Plus, the PASM Sport Suspension Package with Mechanically Locking Rear Differential, bi-xenon…",,"Located in United States","2000s","106671688","false","Chassis: WP0AB29919S722901","71k Miles","3.8-Liter Flat-Six","Six-Speed Manual Transaxle","Arctic Silver Metallic Paint","Black Leather","19"" Harmann Wheels","H&R Springs","Sport Chrono Package Plus","PASM Sport Suspension Package","PCM w/Navigation","Front Sport Seats","Automatic Climate Control","Removed Factory Wheels & Springs","Clean Carfax Report",,,,,,,,,,,,,,,,,"225607","Porsche 997 911 Carrera 4S","Porsche","false","Dealer","false","false","Bid to USD $68,000 <span> on 1/2/26 </span>","2009 Porsche 911 Carrera 4S Coupe 6-Speed","0 Views"
"2026-01-02T19:03:15.000Z","January 2, 2026 at 11:03AM PT","43","395000","false","29022","2028","ended","https://bringatrailer.com/listing/1997-porsche-911-turbo-101/","US","USA","USD","395000","USD $395,000","This 1997 Porsche 911 Turbo is finished in black over black leather with red stitching and is powered by a twin-turbocharged 3.6L flat-six that drives all four wheels through a six-speed manual transaxle with a limited-slip differential. Features include Bilstein PSS9 dampers, RS adjustable sway bars, and 18″ Turbo Twist wheels as well as a…","GSWine","Located in United States","1990s","106696257","false","Chassis: WP0AC2990VS375861","37k Miles Shown","Twin-Turbocharged 3.6L Flat-Six","Six-Speed Manual Transaxle","Limited-Slip Differential","Black Paint","Black Leather Upholstery w/Red Stitching","18″ Turbo Twist Wheels","Bilstein PSS9 Dampers","RS Adjustable Sway Bars","Xenon Headlights","Sunroof","Fixed Rear Spoiler","Power-Adjustable Sport Seats","Digital Sound Package","Cassette Stereo & Six-Disc CD Changer","Automatic Climate Control","Cruise Control","Security System","Window Sticker",,,,,,,,,,,,"225603","Porsche 993 Turbo","Porsche","false","Dealer","false","false","Sold for USD $395,000 <span> on 1/2/26 </span>","37k-Mile 1997 Porsche 911 Turbo","0 Views"
"2026-01-02T18:59:42.000Z","January 2, 2026 at 10:59AM PT","48","57500","false","19479","1862","ended","https://bringatrailer.com/listing/2008-porsche-911-carrera-s-coupe-31/","US","USA","USD","57500","USD $57,500","This 2008 Porsche 911 Carrera S coupe was specified in Basalt Black Metallic over a Sand Beige leather interior, and it was optioned with the Power Seat and Sport Chrono Packages and a Bose sound system. Powered by a 3.8-liter flat-six paired with a six-speed manual transaxle, the car is equipped with 19” Turbo wheels, a deployable rear spoiler,…","LoveGMautos","Located in United States","2000s","106950877","false","Chassis: WP0AB29948S731736","88k Miles","3.8-Liter Flat-Six","Six-Speed Manual Transaxle","Basalt Black Metallic Paint","Sand Beige Leather Upholstery","19” Turbo Wheels","Deployable Rear Spoiler","Bi-Xenon Headlights","Sunroof","Heated Front Seats","Automatic Climate Control","Cruise Control","Pioneer Head Unit w/Integrated Backup Camera","Clean Carfax Report",,,,,,,,,,,,,,,,,"225600","Porsche 997 911 Carrera S","Porsche","true","Private Party","false","true","Sold for USD $57,500 <span> on 1/2/26 </span>","2008 Porsche 911 Carrera S Coupe 6-Speed","0 Views"
"2026-01-02T18:36:07.000Z","January 2, 2026 at 10:36AM PT","50","275930","false","37554","2874","ended","https://bringatrailer.com/listing/1987-porsche-911-turbo-coupe-66/","US","USA","USD","275930","USD $275,930","This 1987 Porsche 911 Turbo coupe was specified in Guards Red over a Champagne Special leather interior with black accents, and it was optioned with a limited-slip differential. Showing 13k miles, the car is powered by a turbocharged 3.3-liter flat-six paired with a four-speed manual transaxle and is equipped with 16&quot; Fuchs alloy wheels,…","Judaglobal","Located in United States","1980s","107088135","false","Chassis: WP0JB0935HS050582","13k Miles Shown","3.3-Liter Flat-Six Shown","Limited-Slip Differential","Beige Leather Upholstery","Guards Red Paint","Champagne Special Leather Upholstery w/Black Accents","16"" Fuchs Alloy Wheels","Sunroof","Front & Rear Spoilers","Power-Adjustable Front Seats","Air Conditioning","Blaupunkt Cassette Stereo","Cruise Control","Certificate of Authenticity","Clean Carfax Report",,,,,,,,,,,,,,,,"225570","Porsche 930 Turbo","Porsche","false","Dealer","false","false","Sold for USD $275,930 <span> on 1/2/26 </span>","13k-Mile 1987 Porsche 911 Turbo Coupe","0 Views"
"2026-01-02T18:27:00.000Z",,,,,,,"ended","https://bringatrailer.com/listing/1972-porsche-911e-coupe-7/","US","USA","USD","40250","USD $40,250","This Porsche 911 coupe is an RSR-style build that was previously used for Rally competition in Europe. Per the owner, the car was most recently prepared for competition in the 2023 GP Ice Race by former winner Kris Rosenberger. A tribute to the Martini-sponsored 911 RSRs run in the Targa Florio, the car has a ducktail spoiler, RSR-style…",,"Located in United States","1970s","107164821","false","Chassis: 9112200306","Twin-Plug 3.8L Flat-Six","Triple-Throat Carburetors","G50 Five-Speed Manual Transaxle","Silver Paint w/Martini Livery","Black Cloth Upholstery","15"" Fuchs-Style Alloy Wheels","Bilstein Dampers","H4 Headlights","Competition Paperwork & Records","PPS Certificate",,,,,,,,,,,,,,,,,,,,,"225699","Porsche LWB 911E (1969-1973)","Porsche","false","Private Party","false","false","Withdrawn by BaT <span> on 1/2/26 </span>","Twin-Plug 3.8L-Powered, RSR-Style Porsche 911 Coupe G50 Race Car","0 Views"
"2026-01-02T18:09:51.000Z","January 2, 2026 at 10:09AM PT","31","263991","false","33654","2362","ended","https://bringatrailer.com/listing/2018-porsche-911-gt3-touring-67/","US","USA","USD","263991","USD $263,991","This 2018 Porsche 911 GT3 Touring is finished in Chalk over Black leather with red and gray checkered inserts and has 2,900 miles. It is powered by a 4.0-liter flat-six paired with a six-speed manual transaxle and is equipped with the Touring Package in Black, the Sport Chrono Package, a front-axle lift system, carbon-fiber-backed bucket seats, a…",,"Located in United States","2010s","106930854","false","Chassis: WP0AC2A92JS175358","2,900 Miles","4.0-Liter Flat-Six","Six-Speed Manual Transaxle","Porsche Torque Vectoring","Chalk Paint","Touring Package in Black","Black Leather w/Checkered Inserts","Carbon-Fiber-Backed Bucket Seats","Black 20"" Center-Lock Wheels","LED Headlights w/PDLS","Sport Chrono Package","Front-Axle Lift System","PASM Dampers","Sport Exhaust","Clean Carfax Report",,,,,,,,,,,,,,,,"225631","Porsche 991 911 GT3","Porsche","false","Dealer","false","false","Bid to USD $263,991 <span> on 1/2/26 </span>","2,900-Mile 2018 Porsche 911 GT3 Touring 6-Speed","0 Views"
"2025-12-31T21:17:56.000Z","December 31, 2025 at 1:17PM PT","30","70000","false","12130","991","ended","https://bringatrailer.com/listing/2004-porsche-911-40th-anniversary-121/","US","USA","USD","70000","USD $70,000","This 2004 Porsche 911 coupe is #1,337 of 1,963 40th Anniversary Edition models produced. It was purchased by its current owner in 2004, and it has 30k miles following registration history in Nevada and Texas. Its 3.6-liter flat-six was rebuilt and upgraded with an LN Engineering dual-row IMS bearing in 2021.","Peterevvv","Located in United States","2000s","106598219","false","Chassis: WP0AA29934S622181","#1337 of 1,963 Examples Produced","30k Miles","Rebuilt 3.6-Liter Flat-Six","X51 Powerkit","2021 LN Engineering IMS Retrofit","Six-Speed Manual Transaxle","Limited-Slip Differential","GT Silver Metallic Paint","Grey Natural Leather Upholstery","18” Carrera II Wheels","Sports Suspension","Sunroof","Heated Power-Adjustable Front Sport Seats","Bose High End Sound System","Automatic Climate Control","Porsche-Branded Luggage Set","Porsche Certificate of Authenticity",,,,,,,,,,,,,,"225481","Porsche 996 911 40th Anniversary Edition","Porsche","false","Dealer","false","false","Sold for USD $70,000 <span> on 12/31/25 </span>","30k-Mile 2004 Porsche 911 40th Anniversary Edition 6-Speed","0 Views"
"2025-12-31T20:25:50.000Z","December 31, 2025 at 12:25PM PT","34","600001","false","33578","2509","ended","https://bringatrailer.com/listing/1994-porsche-911-turbo-3-6-29/","US","USA","USD","600001","USD $600,001","This 1994 Porsche 911 is one of a reported 754 Turbo 3.6 examples produced for the model year, and it left the factory finished in Black over a black interior with heated sport seats. The car is powered by a turbocharged 3.6-liter flat-six paired with a five-speed manual transaxle, and additional details include 18&quot; Speedline wheels, a fixed…","Porschesinger","Located in United States","1990s","107259095","false","Chassis: WP0AC2961RS480338","36k Miles Shown","Turbocharged 3.6L Flat-Six","Five-Speed Manual Transaxle","Black Paint","Black Interior w/ All-Leather Seats","Heated Sport Seats","Blaupunkt Digital Radio","Air Conditioning","Power Sunroof","Carbon-Accented Shifter & Handbrake Lever","Clean Carfax Report",,,,,,,,,,,,,,,,,,,,"225566","Porsche 964 Turbo","Porsche","true","Dealer","false","true","Sold for USD $600,001 <span> on 12/31/25 </span>","36k-Mile 1994 Porsche 911 Turbo 3.6","0 Views"
"2025-12-31T20:08:01.000Z","December 31, 2025 at 12:08PM PT","28","74237","false","7690","816","ended","https://bringatrailer.com/listing/2017-porsche-911-carrera-cabriolet-21/","US","USA","USD","74237","USD $74,237","This 2017 Porsche 911 Carrera cabriolet is finished in Agate Gray Metallic over Black Standard leather and was ordered with the Premium Package Plus, Bose surround sound, a heated GT Sport steering wheel, heated and ventilated front seats, and LED headlights with PDLS+. Power is provided by a twin-turbocharged 3.0L flat-six paired with a…","Butters3","Located in United States","2010s","104521657","false","Chassis: WP0CA2A95HS142394","28k Miles","Twin-Turbocharged 3.0L Flat-Six","Seven-Speed PDK Transaxle","Agate Gray Metallic Paint","Black Standard Leather","Black Soft Top","Premium Package Plus","LED Headlights w/PDLS+","Speed-Activated Rear Spoiler","Heated & Ventilated Front Seats","Bose Surround-Sound System","Heated Steering Wheel","20"" Carrera S Wheels","Clean Carfax Report",,,,,,,,,,,,,,,,,"225560","Porsche 991 911 Carrera","Porsche","false","Dealer","false","false","Sold for USD $74,237 <span> on 12/31/25 </span>","28k-Mile 2017 Porsche 911 Carrera Cabriolet","0 Views"
"2025-12-31T19:59:43.000Z","December 31, 2025 at 11:59AM PT","7","530000","false","15916","1523","ended","https://bringatrailer.com/listing/2019-porsche-911-gt2-rs-22/","US","USA","USD","530000","USD $530,000","This 2018 Porsche 911 is a Chalk-finished GT2 RS that was optioned from the factory with the Weissach and Sport Chrono Packages, in addition to carbon-fiber bucket seats, which are trimmed in black leather and Alcantara upholstery. Indicating 1,400 miles, the car is powered by a twin-turbocharged 3.8L flat-six linked with a seven-speed PDK…","EB992","Located in United States","2010s","107189738","false","Chassis: WP0AE2A99JS186142","1,400 Miles","Twin-Turbocharged 3.8L Flat-Six","Seven-Speed PDK Dual-Clutch Automatic Transaxle","Chalk Paint","Black Leather & Alcantara Upholstery","20"" Center-Lock GT3 Alloy Wheels","Carbon-Ceramic Brakes w/Yellow Calipers","Front Axle Lift System","Rear Axle Steering","Bi-Xenon Headlights","Rear Wing","Extended Range Fuel Tank","Illuminated Carbon-Fiber Door Sill Guards","Bose Surround Sound System","PCM w/Navigation","Clean Carfax Report",,,,,,,,,,,,,,,"225558","Porsche 991 911 GT2","Porsche","false","Dealer","false","false","Sold for USD $530,000 <span> on 12/31/25 </span>","1,400-Mile 2018 Porsche 911 GT2 RS Weissach","0 Views"
"2025-12-31T19:56:49.000Z","December 31, 2025 at 11:56AM PT","8","280000","false","31746","2170","ended","https://bringatrailer.com/listing/2022-porsche-911-turbo-s-coupe-68/","US","USA","USD","280000","USD $280,000","This 2022 Porsche 911 Turbo S coupe has 7k miles following registration history in Texas and California, and it was optioned from the factory with the SportDesign Package in addition to a paint-to-sample Dark Sea Blue exterior finish. Powered by a twin-turbocharged 3.7L flat-six linked with an eight-speed PDK dual-clutch automatic transaxle, the…","SixtySevenRacer","Located in United States","2020s","106871951","false","Chassis: WP0AD2A96NS255782","7k Miles","Twin-Turbocharged 3.7L Flat-Six","Eight-Speed PDK Dual-Clutch Automatic Transaxle","Paint-to-Sample Dark Sea Blue","Truffle Brown Club Leather Upholstery","20"" and 21"" Turbo S Alloy Wheels","SportDesign Package","Porsche Ceramic Composite Brakes","Front-Axle Lift","PASM Sport Suspension","Sport Exhaust System","Heated and Ventilated Front Seats","Burmester Sound System","Adaptive Cruise Control","Lane Change Assist",,,,,,,,,,,,,,,,"225471","Porsche 992 911 Turbo","Porsche","false","Dealer","false","false","Sold for USD $280,000 <span> on 12/31/25 </span>","Dark Sea Blue 2022 Porsche 911 Turbo S Coupe","0 Views"
"2025-12-31T19:49:17.000Z","December 31, 2025 at 11:49AM PT","46","162000","false","23760","1941","ended","https://bringatrailer.com/listing/1992-porsche-911-carrera-2-coupe-37/","US","USA","USD","162000","USD $162,000","This 1992 Porsche 911 Carrera 2 coupe is finished in Signal Green over black leather and has been modified with a 3.8L flat-six equipped with a MoTeC ECU, Recaro seats, a roll bar, and adjustable Bilstein coilovers. It is additionally equipped with a five-speed manual transaxle, a limited-slip differential, 17&quot; Cup wheels, an H&amp;R sway bar,…","mclauc098","Located in United States","1990s","106942769","false","Chassis: WP0AB2964NS420681","155k Miles Shown","3.8-Liter Flat-Six","Five-Speed Manual Transaxle","Limited-Slip Differential","Signal Green","17"" Cup Wheels","Adjustable Bilstein Coilovers","H&R Sway Bar","Recaro Pole Position Seats","Roll Bar","PCCM Head Unit","MOMO Steering Wheel","MoTeC ECU","Aftermarket Exhaust","Accident-Free Carfax Report",,,,,,,,,,,,,,,,"225515","Porsche 964 911 (Non-Turbo)","Porsche","false","Dealer","false","false","Sold for USD $162,000 <span> on 12/31/25 </span>","3.8L-Powered 1992 Porsche 911 Carrera 2 Coupe 5-Speed","0 Views"
"2025-12-31T19:44:00.000Z","December 31, 2025 at 11:44AM PT","43","71000","false","17125","1724","ended","https://bringatrailer.com/listing/2010-porsche-911-carrera-s-coupe-20/","US","USA","USD","71000","USD $71,000","This Canadian-market 2010 Porsche 911 Carrera S coupe was specified in Meteor Gray Metallic over a black leather interior with carbon-fiber Sport bucket seats. Powered by a 3.8-liter flat-six paired with a six-speed manual transaxle, the car features the Sport Chrono Package Plus, the PASM Sports Suspension Package, a limited-slip differential,…","NVJeepGuy","Located in United States","2010s","104958883","false","Chassis: WP0AB2A99AS720815","74k Miles","3.8-Liter 9A1 Flat-Six","Six-Speed Manual Transaxle","Limited-Slip Differential","Meteor Gray Metallic Paint","Black Leather Upholstery","19"" Carrera Sport Wheels","Sport Chrono Package Plus","PASM Sports Suspension Package","Carbon-Fiber Front Sport Bucket Seats","Bi-Xenon Headlights","Deployable Rear Spoiler","Sunroof","Automatic Climate Control","Cruise Control","Clean Carfax Report",,,,,,,,,,,,,,,"225548","Porsche 997 911 Carrera S","Porsche","false","Private Party","false","false","Sold for USD $71,000 <span> on 12/31/25 </span>","2010 Porsche 911 Carrera S Coupe 6-Speed","0 Views"
"2025-12-31T19:33:39.000Z","December 31, 2025 at 11:33AM PT","32","307510","false","35332","2566","ended","https://bringatrailer.com/listing/2022-porsche-911-gt3-touring-139/","US","USA","USD","307510","USD $307,510","This 2022 Porsche 911 GT3 Touring is finished in paint-to-sample Azzuro Thetys Metallic over an Exclusive Manufaktur leather interior in black and Bordeaux Red and is powered by a 4.0-liter flat-six that drives the rear wheels through a six-speed manual transaxle with a mechanical limited-slip differential.","meepcars","Located in United States","2020s","106862364","false","Chassis: WP0AC2A97NS270908","3k Miles","4.0-Liter Flat-Six","Six-Speed Manual Transaxle","Mechanical Limited-Slip Differential","PTS Azzuro Thetys Metallic","Black & Bordeaux Red Exclusive Manufaktur Leather","20"" & 21"" GT3 Center-Lock Wheels","Porsche Ceramic Composite Brakes","Chrono Package","Front Axle Lift System","Carbon Fiber Roof","LED Headlights","Full Bucket Seats","Bose Surround Sound System","Clean Carfax Report",,,,,,,,,,,,,,,,"225468","Porsche 992 911 GT3","Porsche","false","Dealer","false","false","Sold for USD $307,510 <span> on 12/31/25 </span>","Azzuro Thetys Metallic 2022 Porsche 911 GT3 Touring 6-Speed","0 Views"
"2025-12-31T19:07:00.000Z","December 31, 2025 at 11:07AM PT","16","950000","false","72058","3927","ended","https://bringatrailer.com/listing/1997-porsche-911-turbo-s-21/","US","USA","USD","950000","USD $950,000","This 1997 Porsche 911 Turbo S shows 4,200 miles following registration history in California and Montana, and it is said to have remained under the care of its original owner in 2025. A twin-turbocharged 3.6L flat-six drives all four wheels through a six-speed manual transaxle with a limited-slip differential, and the car was specified in Ocean…","Tomcab","Located in United States","1990s","107189412","false","Chassis: WP0AC2996VS375895","4,200 Miles Shown","Twin-Turbocharged 3.6L Flat-Six","Six-Speed Manual Transaxle","Limited-Slip Differential","Ocean Blue Metallic Paint","Cashmere Beige Leather Upholstery","18″ Turbo Twist wheels","Integrated Rear Fender Scoops","Xenon Headlights","Larger Brakes w/Yellow Calipers","Air Conditioning","Nokia Digital Sound processing System","Heated Front Seats","Carbon-Fiber Steering Wheel & Interior Trim","Clean Carfax Report",,,,,,,,,,,,,,,,"225474","Porsche 993 Turbo","Porsche","false","Dealer","false","false","Sold for USD $950,000 <span> on 12/31/25 </span>","4,200-Mile 1997 Porsche 911 Turbo S","0 Views"
"2025-12-31T19:04:46.000Z","December 31, 2025 at 11:04AM PT","54","1000000","false","38710","3053","ended","https://bringatrailer.com/listing/1995-porsche-gunther-werks-400r/","US","USA","USD","890000","USD $890,000","This 1995 Porsche 911 Carrera is one of 25 examples modified by Gunther Werks to their 400R specification. The &quot;Bianco Rosso&quot; commission features carbon-fiber body panels finished in pearlescent white with gray side stripes and red &quot;Porsche&quot; lettering. Power is provided by a Rothsport Racing-built 4.0L flat-six with MoTeC engine management linked…","Joseph05","Located in United States","1990s","106977715","false","Chassis: WP0AA2997SS321958","2,500 Miles Shown on Build","Rothsport Racing-Built 4.0L Flat-Six","Getrag G50 Six-Speed Manual Transaxle","Limited-Slip Differential","Carbon-Fiber Body Panels","White Pearl Effect Paint","Red Alcantara Upholstery","Three-Piece 18"" Wheels","Brembo Disc Brakes","JRZ Adaptive Suspension","Front Lift System","Ducktail Spoiler","Carbon-Fiber Seats","Exposed Carbon-Fiber Interior Panels","Porsche Classic Radio",,,,,,,,,,,,,,,,"225346","Porsche 993 911 (Non-Turbo/GT2)","Porsche","false","Dealer","false","false","Sold for USD $1,000,000 <span> on 12/31/25 </span>","1995 Porsche 911 Carrera Gunther Werks 400R","0 Views"
